sender_name,user_id,sender_email,username,recipient_name,email,recipient_email,phone_number,subject,ip_address,message,transaction_amount,timestamp,transaction_date,attachment,shipping_address,is_read,payment_method,is_spam,device_type
Sukey,230,ijillins6d@wufoo.com,istollenbecker6d,Inez,idacey6d@cloudflare.com,isalleir6d@ucsd.edu,741-156-8224,gravida nisi at nibh in hac habitasse platea dictumst aliquam augue,228.96.17.147,Aenean lectus. Pellentesque eget nunc. Donec quis orci eget orci vehicula condimentum.,6425.69,2/2/2022,8/7/2021,Dui.xls,36 Wayridge Lane,false,paypal,true,tablet
Blinny,231,ijorger6e@netvibes.com,imorston6e,Izak,itomovic6e@google.fr,isheron6e@slashdot.org,920-434-2337,ultrices posuere cubilia curae duis faucibus accumsan odio curabitur convallis duis consequat dui nec nisi volutpat eleifend donec,241.78.186.203,"Morbi porttitor lorem id ligula. Suspendisse ornare consequat lectus. In est risus, auctor sed, tristique in, tempus sit amet, sem.",3605.21,9/15/2022,11/7/2022,DuisFaucibusAccumsan.ppt,062 Knutson Drive,true,credit card,false,mobile
Alejandrina,232,ebowhay6f@ning.com,ewellwood6f,Evelyn,egrinyer6f@jigsy.com,ehaycock6f@cbc.ca,453-996-3181,nibh in hac habitasse platea dictumst aliquam augue quam sollicitudin vitae consectetuer eget rutrum at lorem integer tincidunt,207.119.253.221,"Pellentesque at nulla. Suspendisse potenti. Cras in purus eu magna vulputate luctus.

Cum sociis natoque penatibus et magnis dis parturient montes, nascetur ridiculus mus. Vivamus vestibulum sagittis sapien. Cum sociis natoque penatibus et magnis dis parturient montes, nascetur ridiculus mus.

Etiam vel augue. Vestibulum rutrum rutrum neque. Aenean auctor gravida sem.",8342.44,8/4/2022,6/21/2022,TemporConvallis.avi,8427 Clyde Gallagher Crossing,false,credit card,true,desktop
Hube,233,ckendrick6g@ucla.edu,csearchfield6g,Chicky,clittlefair6g@fda.gov,cloder6g@drupal.org,112-153-8867,erat tortor sollicitudin mi sit amet lobortis sapien sapien non mi integer ac neque duis,179.48.157.155,"Aliquam quis turpis eget elit sodales scelerisque. Mauris sit amet eros. Suspendisse accumsan tortor quis turpis.

Sed ante. Vivamus tortor. Duis mattis egestas metus.",3489.47,7/23/2022,9/23/2020,OdioDonec.ppt,95479 Hooker Terrace,false,paypal,true,tablet
Carlina,234,mlahive6h@msn.com,mtures6h,Marie-jeanne,mmeeny6h@nsw.gov.au,mfreshwater6h@qq.com,873-319-8997,imperdiet et commodo vulputate justo in blandit ultrices enim lorem ipsum dolor sit amet consectetuer adipiscing elit,14.79.170.96,"Pellentesque at nulla. Suspendisse potenti. Cras in purus eu magna vulputate luctus.

Cum sociis natoque penatibus et magnis dis parturient montes, nascetur ridiculus mus. Vivamus vestibulum sagittis sapien. Cum sociis natoque penatibus et magnis dis parturient montes, nascetur ridiculus mus.",8365.05,9/12/2022,10/16/2021,AcDiam.tiff,52922 Brown Trail,true,bitcoin,false,mobile
Brucie,235,tleaves6i@samsung.com,tbrowell6i,Ty,tpischel6i@opensource.org,tsahnow6i@epa.gov,406-632-7412,enim blandit mi in porttitor pede justo eu massa donec dapibus duis at velit eu est congue elementum in,147.232.227.61,"Cras mi pede, malesuada in, imperdiet et, commodo vulputate, justo. In blandit ultrices enim. Lorem ipsum dolor sit amet, consectetuer adipiscing elit.

Proin interdum mauris non ligula pellentesque ultrices. Phasellus id sapien in sapien iaculis congue. Vivamus metus arcu, adipiscing molestie, hendrerit at, vulputate vitae, nisl.

Aenean lectus. Pellentesque eget nunc. Donec quis orci eget orci vehicula condimentum.",7102.16,9/13/2022,2/9/2021,ErosSuspendisseAccumsan.mp3,3354 Debra Drive,false,credit card,true,mobile
Sloan,236,lbrimilcome6j@harvard.edu,lweadick6j,Lesya,lkleynen6j@baidu.com,lstribbling6j@mashable.com,575-871-4839,ut massa volutpat convallis morbi odio odio elementum eu interdum eu tincidunt in leo maecenas pulvinar lobortis,154.126.145.216,Nullam sit amet turpis elementum ligula vehicula consequat. Morbi a ipsum. Integer a nibh.,5432.14,11/23/2022,5/15/2020,Luctus.mp3,1880 Trailsway Parkway,true,paypal,true,desktop
Alana,237,eflaunders6k@istockphoto.com,eablett6k,Eve,elavington6k@github.com,emileham6k@deliciousdays.com,149-526-7219,donec ut mauris eget massa tempor convallis nulla neque libero convallis eget eleifend luctus,13.194.61.235,"Maecenas leo odio, condimentum id, luctus nec, molestie sed, justo. Pellentesque viverra pede ac diam. Cras pellentesque volutpat dui.",3840.22,10/9/2022,4/1/2020,Purus.mpeg,02496 Reinke Road,true,credit card,false,tablet
Gertie,238,zneat6l@google.co.jp,zdevanny6l,Zacharias,zcross6l@sourceforge.net,zkearton6l@washingtonpost.com,898-108-2681,varius integer ac leo pellentesque ultrices mattis odio donec vitae nisi nam,215.113.152.35,"Sed ante. Vivamus tortor. Duis mattis egestas metus.

Aenean fermentum. Donec ut mauris eget massa tempor convallis. Nulla neque libero, convallis eget, eleifend luctus, ultricies eu, nibh.

Quisque id justo sit amet sapien dignissim vestibulum. Vestibulum ante ipsum primis in faucibus orci luctus et ultrices posuere cubilia Curae; Nulla dapibus dolor vel est. Donec odio justo, sollicitudin ut, suscipit a, feugiat et, eros.",8691.98,9/28/2022,2/6/2022,PedePosuereNonummy.jpeg,7 Harbort Alley,false,bitcoin,false,mobile
Emma,239,tennals6m@nps.gov,tgoward6m,Tove,tdavidsson6m@harvard.edu,tleamy6m@jugem.jp,346-447-0137,mi in porttitor pede justo eu massa donec dapibus duis at velit eu,26.136.34.96,"Duis consequat dui nec nisi volutpat eleifend. Donec ut dolor. Morbi vel lectus in quam fringilla rhoncus.

Mauris enim leo, rhoncus sed, vestibulum sit amet, cursus id, turpis. Integer aliquet, massa id lobortis convallis, tortor risus dapibus augue, vel accumsan tellus nisi eu orci. Mauris lacinia sapien quis libero.

Nullam sit amet turpis elementum ligula vehicula consequat. Morbi a ipsum. Integer a nibh.",3820.1,12/3/2022,6/6/2021,VelSem.png,284 Stuart Way,true,paypal,true,tablet
Cordell,240,asleep6n@bloglines.com,aconrart6n,Abdel,acominotti6n@noaa.gov,aclingan6n@so-net.ne.jp,816-210-0404,neque sapien placerat ante nulla justo aliquam quis turpis eget elit sodales scelerisque mauris sit amet eros suspendisse accumsan tortor,32.212.40.200,In congue. Etiam justo. Etiam pretium iaculis justo.,1579.26,5/22/2022,2/5/2022,SemperInterdum.ppt,30589 Spohn Junction,true,bitcoin,true,mobile
Thurston,241,jwalthew6o@apache.org,jwhittlesea6o,Joelie,jbeedom6o@google.nl,jdowyer6o@howstuffworks.com,857-755-9203,nulla pede ullamcorper augue a suscipit nulla elit ac nulla sed vel enim sit amet nunc,252.134.151.224,"Phasellus sit amet erat. Nulla tempus. Vivamus in felis eu sapien cursus vestibulum.

Proin eu mi. Nulla ac enim. In tempor, turpis nec euismod scelerisque, quam turpis adipiscing lorem, vitae mattis nibh ligula nec sem.

Duis aliquam convallis nunc. Proin at turpis a pede posuere nonummy. Integer non velit.",4232.29,1/29/2022,5/31/2022,HabitassePlateaDictumst.mp3,25 Golf Junction,true,bitcoin,false,tablet
Jamey,242,cwhitefoot6p@opera.com,cfusco6p,Chickie,cmorsom6p@skype.com,cwarters6p@about.com,612-987-3219,imperdiet nullam orci pede venenatis non sodales sed tincidunt eu felis fusce posuere felis sed lacus morbi sem mauris,1.96.217.48,"Mauris enim leo, rhoncus sed, vestibulum sit amet, cursus id, turpis. Integer aliquet, massa id lobortis convallis, tortor risus dapibus augue, vel accumsan tellus nisi eu orci. Mauris lacinia sapien quis libero.

Nullam sit amet turpis elementum ligula vehicula consequat. Morbi a ipsum. Integer a nibh.",7099.52,2/7/2022,6/16/2022,Nunc.ppt,59485 Bultman Drive,true,credit card,true,desktop
Katrine,243,sfilippyev6q@miibeian.gov.cn,spashler6q,Simona,stufts6q@cbsnews.com,seates6q@columbia.edu,877-614-8734,sed augue aliquam erat volutpat in congue etiam justo etiam pretium iaculis,182.137.62.42,Fusce consequat. Nulla nisl. Nunc nisl.,6504.38,11/5/2022,4/12/2021,NamCongue.mov,60898 Longview Pass,true,paypal,true,desktop
Silvia,244,everden6r@washington.edu,ejedrasik6r,Evyn,efrancioli6r@com.com,ehutchinson6r@boston.com,934-927-5735,bibendum felis sed interdum venenatis turpis enim blandit mi in porttitor pede justo eu massa donec,133.50.58.126,"In hac habitasse platea dictumst. Etiam faucibus cursus urna. Ut tellus.

Nulla ut erat id mauris vulputate elementum. Nullam varius. Nulla facilisi.",1079.41,11/28/2022,9/15/2022,Lectus.png,59201 Scoville Circle,false,bitcoin,true,mobile
Shelley,245,iporker6s@yellowbook.com,icokly6s,Isa,isugge6s@cnet.com,ihaseman6s@hhs.gov,729-457-6491,lectus in est risus auctor sed tristique in tempus sit amet sem,58.183.146.118,"Nullam sit amet turpis elementum ligula vehicula consequat. Morbi a ipsum. Integer a nibh.

In quis justo. Maecenas rhoncus aliquam lacus. Morbi quis tortor id nulla ultrices aliquet.

Maecenas leo odio, condimentum id, luctus nec, molestie sed, justo. Pellentesque viverra pede ac diam. Cras pellentesque volutpat dui.",5287.74,12/11/2022,9/7/2020,Justo.tiff,48747 Hollow Ridge Place,false,paypal,false,desktop
Fern,246,llesarr6t@spotify.com,lpaice6t,Leanna,ltym6t@eepurl.com,lmckeller6t@shareasale.com,444-489-1886,neque vestibulum eget vulputate ut ultrices vel augue vestibulum ante ipsum primis in faucibus orci luctus et ultrices,220.59.36.77,In congue. Etiam justo. Etiam pretium iaculis justo.,2867.93,4/28/2022,6/28/2020,MaecenasLeo.jpeg,4 Troy Plaza,false,bitcoin,false,mobile
Morissa,247,jcarnson6u@google.com.hk,jsircomb6u,Judy,jbyatt6u@psu.edu,jjakubovits6u@umn.edu,700-835-3934,vestibulum ante ipsum primis in faucibus orci luctus et ultrices posuere cubilia curae nulla dapibus dolor vel est,31.52.50.182,"Cras mi pede, malesuada in, imperdiet et, commodo vulputate, justo. In blandit ultrices enim. Lorem ipsum dolor sit amet, consectetuer adipiscing elit.

Proin interdum mauris non ligula pellentesque ultrices. Phasellus id sapien in sapien iaculis congue. Vivamus metus arcu, adipiscing molestie, hendrerit at, vulputate vitae, nisl.",4920.84,12/22/2022,6/19/2022,Tincidunt.mp3,46662 Hooker Way,false,credit card,true,tablet
Hallsy,248,tjory6v@kickstarter.com,twollacott6v,Tani,ttolliday6v@360.cn,tdalyiel6v@myspace.com,177-519-6963,etiam justo etiam pretium iaculis justo in hac habitasse platea dictumst etiam faucibus cursus urna ut tellus nulla ut,144.44.87.136,"Mauris enim leo, rhoncus sed, vestibulum sit amet, cursus id, turpis. Integer aliquet, massa id lobortis convallis, tortor risus dapibus augue, vel accumsan tellus nisi eu orci. Mauris lacinia sapien quis libero.

Nullam sit amet turpis elementum ligula vehicula consequat. Morbi a ipsum. Integer a nibh.",5202.65,1/26/2022,8/13/2022,ConsectetuerEgetRutrum.ppt,87 Scott Road,false,paypal,true,desktop
Wilow,249,jdobrowski6w@microsoft.com,jbosenworth6w,Jesse,jdesouza6w@reverbnation.com,jiron6w@shutterfly.com,952-885-7114,mauris laoreet ut rhoncus aliquet pulvinar sed nisl nunc rhoncus dui vel sem sed sagittis nam congue risus,251.98.1.182,"In congue. Etiam justo. Etiam pretium iaculis justo.

In hac habitasse platea dictumst. Etiam faucibus cursus urna. Ut tellus.

Nulla ut erat id mauris vulputate elementum. Nullam varius. Nulla facilisi.",9458.21,6/3/2022,4/18/2020,Sed.ppt,64 Pleasure Drive,false,paypal,false,desktop
Susannah,250,jnollet6x@is.gd,jdowsing6x,Jillene,jkeitch6x@gnu.org,jheakins6x@studiopress.com,662-645-9752,est et tempus semper est quam pharetra magna ac consequat metus sapien ut nunc vestibulum,246.185.214.140,"Curabitur in libero ut massa volutpat convallis. Morbi odio odio, elementum eu, interdum eu, tincidunt in, leo. Maecenas pulvinar lobortis est.

Phasellus sit amet erat. Nulla tempus. Vivamus in felis eu sapien cursus vestibulum.

Proin eu mi. Nulla ac enim. In tempor, turpis nec euismod scelerisque, quam turpis adipiscing lorem, vitae mattis nibh ligula nec sem.",3141.54,10/25/2022,4/20/2020,A.mp3,286 Toban Center,false,bitcoin,false,tablet
Natty,251,oleidl6y@odnoklassniki.ru,otrytsman6y,Orlando,odorracott6y@bigcartel.com,origg6y@yahoo.com,456-775-3149,semper sapien a libero nam dui proin leo odio porttitor id consequat in consequat ut nulla sed accumsan felis ut,170.191.216.107,"In sagittis dui vel nisl. Duis ac nibh. Fusce lacus purus, aliquet at, feugiat non, pretium quis, lectus.",5308.19,3/29/2022,7/25/2022,EnimBlandit.avi,1176 Armistice Drive,false,credit card,true,mobile
Julina,252,pstitson6z@canalblog.com,phuttley6z,Phaedra,psnalham6z@yolasite.com,ppfeuffer6z@bandcamp.com,945-104-8017,volutpat quam pede lobortis ligula sit amet eleifend pede libero quis orci nullam molestie nibh,173.214.114.61,"Phasellus sit amet erat. Nulla tempus. Vivamus in felis eu sapien cursus vestibulum.

Proin eu mi. Nulla ac enim. In tempor, turpis nec euismod scelerisque, quam turpis adipiscing lorem, vitae mattis nibh ligula nec sem.",1083.93,11/19/2022,10/27/2022,AnteIpsumPrimis.avi,9495 Paget Court,true,bitcoin,true,desktop
Grayce,253,ibenedicte70@hostgator.com,icuree70,Ivory,iwarhurst70@blogs.com,ipideon70@examiner.com,609-307-3269,sit amet eleifend pede libero quis orci nullam molestie nibh in lectus pellentesque at nulla,178.103.95.190,"Nulla ut erat id mauris vulputate elementum. Nullam varius. Nulla facilisi.

Cras non velit nec nisi vulputate nonummy. Maecenas tincidunt lacus at velit. Vivamus vel nulla eget eros elementum pellentesque.

Quisque porta volutpat erat. Quisque erat eros, viverra eget, congue eget, semper rutrum, nulla. Nunc purus.",891.69,7/10/2022,11/8/2020,Sit.doc,412 Darwin Terrace,false,credit card,true,desktop
Muhammad,254,mbunn71@sina.com.cn,mcreswell71,Marja,mlasselle71@youtube.com,marmatys71@privacy.gov.au,177-658-9658,ac consequat metus sapien ut nunc vestibulum ante ipsum primis in faucibus orci,170.137.107.15,Phasellus in felis. Donec semper sapien a libero. Nam dui.,1478.93,4/22/2022,12/26/2021,LiberoNullamSit.avi,74 Butterfield Drive,false,bitcoin,true,desktop
Francis,255,mdeare72@imageshack.us,mierland72,Marie-jeanne,mleatherbarrow72@telegraph.co.uk,mlarret72@redcross.org,306-796-8987,elit proin risus praesent lectus vestibulum quam sapien varius ut blandit non,11.95.138.223,"Praesent id massa id nisl venenatis lacinia. Aenean sit amet justo. Morbi ut odio.

Cras mi pede, malesuada in, imperdiet et, commodo vulputate, justo. In blandit ultrices enim. Lorem ipsum dolor sit amet, consectetuer adipiscing elit.",175.05,7/2/2022,11/16/2022,ConsectetuerEgetRutrum.ppt,79 Jana Point,false,bitcoin,true,tablet
Devlin,256,ballerton73@tuttocitta.it,btrobridge73,Barnie,bcordeix73@usda.gov,bgrieveson73@dailymail.co.uk,835-854-0213,in hac habitasse platea dictumst aliquam augue quam sollicitudin vitae consectetuer eget rutrum at lorem integer tincidunt,205.187.73.78,"Quisque id justo sit amet sapien dignissim vestibulum. Vestibulum ante ipsum primis in faucibus orci luctus et ultrices posuere cubilia Curae; Nulla dapibus dolor vel est. Donec odio justo, sollicitudin ut, suscipit a, feugiat et, eros.",5337.41,5/10/2022,2/4/2021,AccumsanFelis.mov,65469 Pankratz Plaza,true,bitcoin,true,desktop
Abbi,257,sholdall74@unc.edu,smeakin74,Saleem,ssprott74@archive.org,sverma74@oaic.gov.au,327-649-1588,libero quis orci nullam molestie nibh in lectus pellentesque at,164.195.11.90,"Cum sociis natoque penatibus et magnis dis parturient montes, nascetur ridiculus mus. Vivamus vestibulum sagittis sapien. Cum sociis natoque penatibus et magnis dis parturient montes, nascetur ridiculus mus.

Etiam vel augue. Vestibulum rutrum rutrum neque. Aenean auctor gravida sem.

Praesent id massa id nisl venenatis lacinia. Aenean sit amet justo. Morbi ut odio.",8770.49,5/26/2022,11/15/2022,Pede.txt,753 South Place,false,bitcoin,false,mobile
Rodrique,258,kmelia75@webs.com,kmcgilmartin75,Kessia,kiddins75@reuters.com,kbunch75@taobao.com,434-791-6430,lorem integer tincidunt ante vel ipsum praesent blandit lacinia erat,160.64.46.46,"In hac habitasse platea dictumst. Etiam faucibus cursus urna. Ut tellus.

Nulla ut erat id mauris vulputate elementum. Nullam varius. Nulla facilisi.

Cras non velit nec nisi vulputate nonummy. Maecenas tincidunt lacus at velit. Vivamus vel nulla eget eros elementum pellentesque.",8934.42,11/26/2022,2/5/2022,EratVolutpatIn.tiff,5 Loomis Junction,true,credit card,true,tablet
Yvette,259,qdanaher76@washingtonpost.com,qenoksson76,Quent,qbasey76@slideshare.net,qoattes76@pagesperso-orange.fr,603-980-1281,est lacinia nisi venenatis tristique fusce congue diam id ornare,70.78.163.195,Duis consequat dui nec nisi volutpat eleifend. Donec ut dolor. Morbi vel lectus in quam fringilla rhoncus.,7877.47,6/1/2022,5/28/2020,Mi.mp3,97882 Ohio Circle,false,paypal,false,tablet
Any,260,pruckledge77@dyndns.org,pcalvert77,Perice,pchavey77@mail.ru,pkarczinski77@nasa.gov,798-676-2623,commodo vulputate justo in blandit ultrices enim lorem ipsum dolor sit amet consectetuer adipiscing elit proin interdum mauris non ligula,234.8.238.200,"Vestibulum ac est lacinia nisi venenatis tristique. Fusce congue, diam id ornare imperdiet, sapien urna pretium nisl, ut volutpat sapien arcu sed augue. Aliquam erat volutpat.",4990.31,2/21/2022,3/4/2020,InHacHabitasse.mov,25535 Doe Crossing Trail,false,credit card,false,tablet
Siana,261,cflay78@squidoo.com,cdevenport78,Corrianne,cbanane78@scribd.com,cnunesnabarro78@biblegateway.com,876-522-6080,scelerisque mauris sit amet eros suspendisse accumsan tortor quis turpis sed ante vivamus tortor duis,103.13.75.184,"Maecenas ut massa quis augue luctus tincidunt. Nulla mollis molestie lorem. Quisque ut erat.

Curabitur gravida nisi at nibh. In hac habitasse platea dictumst. Aliquam augue quam, sollicitudin vitae, consectetuer eget, rutrum at, lorem.

Integer tincidunt ante vel ipsum. Praesent blandit lacinia erat. Vestibulum sed magna at nunc commodo placerat.",9342.22,3/17/2022,2/3/2022,CongueElementum.xls,33713 Nevada Road,true,credit card,true,mobile
Dacia,262,fhurdidge79@flickr.com,fmurrhaupt79,Flo,fkalisch79@sitemeter.com,fcarrabot79@timesonline.co.uk,568-600-1612,duis ac nibh fusce lacus purus aliquet at feugiat non pretium quis lectus suspendisse potenti in eleifend quam,140.127.180.28,"Proin leo odio, porttitor id, consequat in, consequat ut, nulla. Sed accumsan felis. Ut at dolor quis odio consequat varius.",5370.05,11/19/2022,11/8/2021,OrciLuctusEt.xls,59 Lillian Center,false,bitcoin,true,mobile
Bay,263,vbarefoot7a@indiatimes.com,vacosta7a,Van,vboreham7a@fotki.com,vkirkness7a@list-manage.com,553-682-6239,donec posuere metus vitae ipsum aliquam non mauris morbi non lectus aliquam sit,20.241.190.255,"Quisque porta volutpat erat. Quisque erat eros, viverra eget, congue eget, semper rutrum, nulla. Nunc purus.",4177.88,11/22/2022,2/12/2021,LectusPellentesque.xls,24065 Ludington Hill,true,bitcoin,true,tablet
Currey,264,jpettecrew7b@oaic.gov.au,jesposito7b,Johnathon,jlandells7b@nytimes.com,jjude7b@slate.com,839-456-8504,semper sapien a libero nam dui proin leo odio porttitor id consequat in consequat ut nulla sed accumsan felis ut,163.210.24.236,"Vestibulum ac est lacinia nisi venenatis tristique. Fusce congue, diam id ornare imperdiet, sapien urna pretium nisl, ut volutpat sapien arcu sed augue. Aliquam erat volutpat.",6253.21,12/28/2022,4/6/2021,VulputateVitaeNisl.tiff,2620 Lillian Court,false,credit card,true,desktop
Chick,265,inockalls7c@adobe.com,ieccersley7c,Inez,igravells7c@archive.org,imicheli7c@xinhuanet.com,919-584-2492,egestas metus aenean fermentum donec ut mauris eget massa tempor convallis nulla neque libero,41.81.213.9,"Etiam vel augue. Vestibulum rutrum rutrum neque. Aenean auctor gravida sem.

Praesent id massa id nisl venenatis lacinia. Aenean sit amet justo. Morbi ut odio.

Cras mi pede, malesuada in, imperdiet et, commodo vulputate, justo. In blandit ultrices enim. Lorem ipsum dolor sit amet, consectetuer adipiscing elit.",6116.8,12/26/2022,2/19/2021,Primis.pdf,5 Northfield Street,false,bitcoin,true,mobile
Cindee,266,agaylord7d@over-blog.com,aworsnip7d,Ainslee,afozzard7d@businessinsider.com,aband7d@pbs.org,879-929-1817,purus aliquet at feugiat non pretium quis lectus suspendisse potenti in eleifend quam a,67.49.66.22,"Nullam porttitor lacus at turpis. Donec posuere metus vitae ipsum. Aliquam non mauris.

Morbi non lectus. Aliquam sit amet diam in magna bibendum imperdiet. Nullam orci pede, venenatis non, sodales sed, tincidunt eu, felis.",945.0,11/20/2022,6/9/2022,Lacus.tiff,96309 Katie Parkway,true,paypal,true,mobile
Caressa,267,rstutter7e@rambler.ru,rrosenfelder7e,Rhodia,rsobey7e@odnoklassniki.ru,rfretter7e@amazon.de,789-533-9856,accumsan odio curabitur convallis duis consequat dui nec nisi volutpat eleifend donec ut dolor morbi vel lectus in,139.202.248.29,"In hac habitasse platea dictumst. Etiam faucibus cursus urna. Ut tellus.

Nulla ut erat id mauris vulputate elementum. Nullam varius. Nulla facilisi.",3287.92,5/18/2022,12/9/2022,VivamusMetus.tiff,125 Talisman Crossing,true,credit card,false,desktop
Xenia,268,jfossick7f@va.gov,jfeaveer7f,Jackson,jsperring7f@technorati.com,jdorran7f@un.org,570-928-5688,nisi eu orci mauris lacinia sapien quis libero nullam sit amet turpis elementum ligula vehicula consequat morbi a ipsum integer,124.10.117.7,"Praesent id massa id nisl venenatis lacinia. Aenean sit amet justo. Morbi ut odio.

Cras mi pede, malesuada in, imperdiet et, commodo vulputate, justo. In blandit ultrices enim. Lorem ipsum dolor sit amet, consectetuer adipiscing elit.

Proin interdum mauris non ligula pellentesque ultrices. Phasellus id sapien in sapien iaculis congue. Vivamus metus arcu, adipiscing molestie, hendrerit at, vulputate vitae, nisl.",842.42,1/14/2022,12/8/2022,Posuere.mp3,1489 Becker Drive,true,paypal,false,tablet
Nannie,269,nletchford7g@phpbb.com,nfrascone7g,Neysa,nbeniesh7g@desdev.cn,nmoncrefe7g@goo.ne.jp,156-793-7239,ligula pellentesque ultrices phasellus id sapien in sapien iaculis congue vivamus metus arcu adipiscing molestie hendrerit at vulputate vitae nisl,211.227.58.25,"Proin leo odio, porttitor id, consequat in, consequat ut, nulla. Sed accumsan felis. Ut at dolor quis odio consequat varius.

Integer ac leo. Pellentesque ultrices mattis odio. Donec vitae nisi.

Nam ultrices, libero non mattis pulvinar, nulla pede ullamcorper augue, a suscipit nulla elit ac nulla. Sed vel enim sit amet nunc viverra dapibus. Nulla suscipit ligula in lacus.",7614.12,12/26/2022,7/18/2020,Lectus.avi,5941 Monterey Trail,true,bitcoin,true,desktop
Babette,270,byeardsley7h@mapy.cz,bmeighan7h,Brett,brouke7h@gnu.org,bketteringham7h@timesonline.co.uk,460-545-9361,donec posuere metus vitae ipsum aliquam non mauris morbi non,176.111.150.58,"Praesent id massa id nisl venenatis lacinia. Aenean sit amet justo. Morbi ut odio.

Cras mi pede, malesuada in, imperdiet et, commodo vulputate, justo. In blandit ultrices enim. Lorem ipsum dolor sit amet, consectetuer adipiscing elit.",5528.86,1/20/2022,6/5/2022,Amet.ppt,4 Commercial Hill,true,credit card,false,tablet
Janek,271,drudgard7i@answers.com,dbirtley7i,Duff,deyer7i@google.ca,diacavone7i@narod.ru,631-184-3749,suspendisse potenti in eleifend quam a odio in hac habitasse,72.41.225.215,"Pellentesque at nulla. Suspendisse potenti. Cras in purus eu magna vulputate luctus.

Cum sociis natoque penatibus et magnis dis parturient montes, nascetur ridiculus mus. Vivamus vestibulum sagittis sapien. Cum sociis natoque penatibus et magnis dis parturient montes, nascetur ridiculus mus.

Etiam vel augue. Vestibulum rutrum rutrum neque. Aenean auctor gravida sem.",6183.9,11/2/2022,1/21/2020,MagnisDisParturient.mp3,459 Aberg Center,true,bitcoin,false,tablet
Linnie,272,bpickerill7j@dion.ne.jp,bdunnion7j,Benedetta,bygo7j@icio.us,bsilmon7j@cbslocal.com,365-189-2261,ultricies eu nibh quisque id justo sit amet sapien dignissim vestibulum,84.166.228.222,"Donec diam neque, vestibulum eget, vulputate ut, ultrices vel, augue. Vestibulum ante ipsum primis in faucibus orci luctus et ultrices posuere cubilia Curae; Donec pharetra, magna vestibulum aliquet ultrices, erat tortor sollicitudin mi, sit amet lobortis sapien sapien non mi. Integer ac neque.

Duis bibendum. Morbi non quam nec dui luctus rutrum. Nulla tellus.",3011.99,5/17/2022,4/23/2021,Duis.avi,1011 Eastlawn Parkway,false,paypal,false,desktop
Lorne,273,mbedbury7k@tinypic.com,mpichan7k,Marcello,mmaddrell7k@blogger.com,mhitcham7k@msn.com,407-202-9801,nam congue risus semper porta volutpat quam pede lobortis ligula sit amet eleifend pede,17.127.243.133,"Duis aliquam convallis nunc. Proin at turpis a pede posuere nonummy. Integer non velit.

Donec diam neque, vestibulum eget, vulputate ut, ultrices vel, augue. Vestibulum ante ipsum primis in faucibus orci luctus et ultrices posuere cubilia Curae; Donec pharetra, magna vestibulum aliquet ultrices, erat tortor sollicitudin mi, sit amet lobortis sapien sapien non mi. Integer ac neque.

Duis bibendum. Morbi non quam nec dui luctus rutrum. Nulla tellus.",2366.39,12/21/2022,1/23/2020,BibendumMorbi.doc,40808 David Place,true,paypal,true,desktop
Damiano,274,gwaycott7l@ibm.com,gchuter7l,Georas,gmatteoli7l@toplist.cz,gluipold7l@google.nl,264-790-1937,potenti nullam porttitor lacus at turpis donec posuere metus vitae ipsum aliquam non mauris morbi non lectus aliquam,169.236.26.27,"Aenean fermentum. Donec ut mauris eget massa tempor convallis. Nulla neque libero, convallis eget, eleifend luctus, ultricies eu, nibh.

Quisque id justo sit amet sapien dignissim vestibulum. Vestibulum ante ipsum primis in faucibus orci luctus et ultrices posuere cubilia Curae; Nulla dapibus dolor vel est. Donec odio justo, sollicitudin ut, suscipit a, feugiat et, eros.

Vestibulum ac est lacinia nisi venenatis tristique. Fusce congue, diam id ornare imperdiet, sapien urna pretium nisl, ut volutpat sapien arcu sed augue. Aliquam erat volutpat.",3587.64,11/30/2022,12/17/2022,NullamVariusNulla.gif,7757 Lillian Road,true,paypal,false,mobile
