sender_name,user_id,sender_email,username,recipient_name,email,recipient_email,phone_number,subject,ip_address,message,transaction_amount,timestamp,transaction_date,attachment,shipping_address,is_read,payment_method,is_spam,device_type
Sybil,458,fvasishchevcp@rakuten.co.jp,fhallibertoncp,Fairlie,fjaimezcp@alibaba.com,fdempseycp@homestead.com,855-100-7179,ipsum primis in faucibus orci luctus et ultrices posuere cubilia curae nulla dapibus dolor vel est,1.245.176.80,"Mauris enim leo, rhoncus sed, vestibulum sit amet, cursus id, turpis. Integer aliquet, massa id lobortis convallis, tortor risus dapibus augue, vel accumsan tellus nisi eu orci. Mauris lacinia sapien quis libero.",8050.79,7/20/2022,1/19/2021,Vulputate.ppt,10860 Susan Park,false,paypal,false,mobile
Ollie,459,dricardoucq@blogtalkradio.com,dmchalecq,Dionysus,dfeviercq@nbcnews.com,dovernellcq@geocities.com,885-743-4995,nulla justo aliquam quis turpis eget elit sodales scelerisque mauris sit amet eros suspendisse accumsan tortor quis,113.134.253.72,"Aenean fermentum. Donec ut mauris eget massa tempor convallis. Nulla neque libero, convallis eget, eleifend luctus, ultricies eu, nibh.",4041.37,6/15/2022,9/6/2022,Consequat.mpeg,5595 Bay Pass,true,paypal,true,mobile
Eugen,460,cpantrycr@ow.ly,ccammellcr,Charlotte,cshuardcr@homestead.com,cmccaghancr@reddit.com,561-406-1478,pulvinar lobortis est phasellus sit amet erat nulla tempus vivamus in felis eu sapien cursus vestibulum proin eu,134.54.252.103,"Duis consequat dui nec nisi volutpat eleifend. Donec ut dolor. Morbi vel lectus in quam fringilla rhoncus.

Mauris enim leo, rhoncus sed, vestibulum sit amet, cursus id, turpis. Integer aliquet, massa id lobortis convallis, tortor risus dapibus augue, vel accumsan tellus nisi eu orci. Mauris lacinia sapien quis libero.

Nullam sit amet turpis elementum ligula vehicula consequat. Morbi a ipsum. Integer a nibh.",557.67,1/2/2022,7/7/2022,LacusAt.mp3,82253 Columbus Place,true,paypal,false,mobile
Portie,461,stasselcs@multiply.com,solandacs,Samaria,sjaggardcs@ucsd.edu,semmetcs@bizjournals.com,862-826-2483,pede lobortis ligula sit amet eleifend pede libero quis orci nullam molestie nibh in lectus,18.196.163.18,"Maecenas tristique, est et tempus semper, est quam pharetra magna, ac consequat metus sapien ut nunc. Vestibulum ante ipsum primis in faucibus orci luctus et ultrices posuere cubilia Curae; Mauris viverra diam vitae quam. Suspendisse potenti.",1677.2,11/5/2022,12/7/2020,VelitNecNisi.mpeg,65531 Fordem Point,true,credit card,false,mobile
Brade,462,lgaugect@sphinn.com,lbeddonct,Lamond,lpaulict@multiply.com,lenstenct@rakuten.co.jp,343-647-2822,donec ut dolor morbi vel lectus in quam fringilla rhoncus mauris enim leo,71.166.52.240,"Proin interdum mauris non ligula pellentesque ultrices. Phasellus id sapien in sapien iaculis congue. Vivamus metus arcu, adipiscing molestie, hendrerit at, vulputate vitae, nisl.

Aenean lectus. Pellentesque eget nunc. Donec quis orci eget orci vehicula condimentum.",8076.8,11/10/2022,3/1/2020,UtTellus.jpeg,30 Rockefeller Point,false,paypal,false,tablet
Almeda,463,lmcgirrcu@istockphoto.com,lchallicecu,Loni,ldunnettcu@chicagotribune.com,lmalshercu@amazon.co.jp,920-825-3352,eleifend donec ut dolor morbi vel lectus in quam fringilla rhoncus mauris enim leo rhoncus sed vestibulum,178.60.231.50,Phasellus sit amet erat. Nulla tempus. Vivamus in felis eu sapien cursus vestibulum.,2350.23,8/11/2022,9/15/2021,Nec.mp3,646 Upham Lane,true,credit card,false,desktop
Madelina,464,dholttomcv@github.com,dmcgeochcv,Doris,dtolputtcv@shareasale.com,dvearncombcv@archive.org,221-847-7039,sapien varius ut blandit non interdum in ante vestibulum ante ipsum primis in,39.11.92.72,Etiam vel augue. Vestibulum rutrum rutrum neque. Aenean auctor gravida sem.,4009.22,8/26/2022,5/21/2022,ALibero.png,58158 Steensland Way,true,bitcoin,false,mobile
Tabby,465,gcroasdalecw@reddit.com,gvillierscw,Grayce,gemmcw@g.co,gcellercw@cam.ac.uk,837-708-5890,elit sodales scelerisque mauris sit amet eros suspendisse accumsan tortor quis turpis sed ante vivamus tortor duis mattis egestas,195.211.66.64,"Aenean fermentum. Donec ut mauris eget massa tempor convallis. Nulla neque libero, convallis eget, eleifend luctus, ultricies eu, nibh.

Quisque id justo sit amet sapien dignissim vestibulum. Vestibulum ante ipsum primis in faucibus orci luctus et ultrices posuere cubilia Curae; Nulla dapibus dolor vel est. Donec odio justo, sollicitudin ut, suscipit a, feugiat et, eros.

Vestibulum ac est lacinia nisi venenatis tristique. Fusce congue, diam id ornare imperdiet, sapien urna pretium nisl, ut volutpat sapien arcu sed augue. Aliquam erat volutpat.",3159.65,4/10/2022,2/23/2021,Erat.jpeg,56349 Lunder Hill,false,paypal,false,tablet
Tomkin,466,shenrotcx@columbia.edu,sedlynecx,Sidney,ssprowellcx@vk.com,smolloycx@gnu.org,409-250-1762,in lectus pellentesque at nulla suspendisse potenti cras in purus eu magna vulputate luctus,167.11.208.65,"Proin eu mi. Nulla ac enim. In tempor, turpis nec euismod scelerisque, quam turpis adipiscing lorem, vitae mattis nibh ligula nec sem.

Duis aliquam convallis nunc. Proin at turpis a pede posuere nonummy. Integer non velit.",385.82,2/7/2022,11/1/2020,ArcuAdipiscingMolestie.jpeg,8763 Ohio Way,true,credit card,false,mobile
Elinor,467,mdomangecy@tmall.com,mdaftercy,Marietta,mpickerillcy@imgur.com,mtaigcy@cnn.com,825-444-3993,metus aenean fermentum donec ut mauris eget massa tempor convallis nulla neque libero convallis,253.97.247.4,Duis bibendum. Morbi non quam nec dui luctus rutrum. Nulla tellus.,607.37,5/29/2022,2/23/2020,NislDuisBibendum.avi,3950 Schurz Terrace,false,bitcoin,true,tablet
Sarina,468,lmcgourtycz@mac.com,lgerckencz,Launce,lgippcz@blinklist.com,lbettertoncz@wikimedia.org,772-336-1310,fusce consequat nulla nisl nunc nisl duis bibendum felis sed interdum venenatis turpis enim blandit mi in,140.177.202.254,Sed ante. Vivamus tortor. Duis mattis egestas metus.,4952.53,7/2/2022,2/8/2021,AtDolorQuis.jpeg,9 Scoville Way,true,paypal,false,desktop
Enrico,469,gkeyzmand0@cnbc.com,gsimkod0,Gunilla,gcradeyd0@google.it,gtolmand0@google.com.br,977-654-7882,rutrum at lorem integer tincidunt ante vel ipsum praesent blandit lacinia,234.10.244.100,"Morbi porttitor lorem id ligula. Suspendisse ornare consequat lectus. In est risus, auctor sed, tristique in, tempus sit amet, sem.

Fusce consequat. Nulla nisl. Nunc nisl.",5476.04,9/19/2022,7/23/2021,IpsumDolorSit.mp3,83804 Florence Park,true,credit card,true,desktop
Fletch,470,jtaylourd1@pagesperso-orange.fr,jedwardd1,Jamison,jsuggettd1@opensource.org,jhuncootd1@nature.com,840-510-2812,ut ultrices vel augue vestibulum ante ipsum primis in faucibus orci luctus et ultrices posuere cubilia curae donec,50.26.50.72,"Curabitur in libero ut massa volutpat convallis. Morbi odio odio, elementum eu, interdum eu, tincidunt in, leo. Maecenas pulvinar lobortis est.

Phasellus sit amet erat. Nulla tempus. Vivamus in felis eu sapien cursus vestibulum.",2705.06,5/8/2022,9/15/2021,EnimIn.pdf,39963 Golden Leaf Pass,true,credit card,false,desktop
Brion,471,vminthorped2@slashdot.org,vbleakleyd2,Venita,vgilderoyd2@theglobeandmail.com,vlecountd2@shop-pro.jp,924-396-4117,integer a nibh in quis justo maecenas rhoncus aliquam lacus morbi quis tortor id nulla ultrices,202.32.162.147,"Curabitur gravida nisi at nibh. In hac habitasse platea dictumst. Aliquam augue quam, sollicitudin vitae, consectetuer eget, rutrum at, lorem.",8938.82,4/5/2022,5/23/2022,Vitae.ppt,4130 6th Hill,true,credit card,true,desktop
Yoko,472,bjeward3@slashdot.org,bskrzynskid3,Bettine,bfidgind3@multiply.com,bkitterd3@facebook.com,986-918-1234,nec dui luctus rutrum nulla tellus in sagittis dui vel nisl duis ac nibh,120.165.26.104,"Proin leo odio, porttitor id, consequat in, consequat ut, nulla. Sed accumsan felis. Ut at dolor quis odio consequat varius.

Integer ac leo. Pellentesque ultrices mattis odio. Donec vitae nisi.

Nam ultrices, libero non mattis pulvinar, nulla pede ullamcorper augue, a suscipit nulla elit ac nulla. Sed vel enim sit amet nunc viverra dapibus. Nulla suscipit ligula in lacus.",1122.16,9/29/2022,5/14/2022,EtCommodo.mp3,9181 Independence Road,false,credit card,false,mobile
Shane,473,rdoryd4@upenn.edu,rcorzond4,Richmound,rkohnertd4@columbia.edu,rblasingd4@phoca.cz,345-726-7454,aliquam convallis nunc proin at turpis a pede posuere nonummy integer non,196.59.116.104,"Donec diam neque, vestibulum eget, vulputate ut, ultrices vel, augue. Vestibulum ante ipsum primis in faucibus orci luctus et ultrices posuere cubilia Curae; Donec pharetra, magna vestibulum aliquet ultrices, erat tortor sollicitudin mi, sit amet lobortis sapien sapien non mi. Integer ac neque.

Duis bibendum. Morbi non quam nec dui luctus rutrum. Nulla tellus.",7072.29,3/22/2022,3/19/2021,EtUltricesPosuere.txt,9048 Crest Line Crossing,true,bitcoin,false,desktop
Patrizio,474,mbritlandd5@shareasale.com,mearengeyd5,Mathian,mlegerwoodd5@dell.com,mjonasd5@nbcnews.com,614-944-7534,erat id mauris vulputate elementum nullam varius nulla facilisi cras non velit nec nisi vulputate nonummy,223.173.162.206,"Donec diam neque, vestibulum eget, vulputate ut, ultrices vel, augue. Vestibulum ante ipsum primis in faucibus orci luctus et ultrices posuere cubilia Curae; Donec pharetra, magna vestibulum aliquet ultrices, erat tortor sollicitudin mi, sit amet lobortis sapien sapien non mi. Integer ac neque.",7873.74,10/11/2022,11/6/2021,EgetEros.xls,848 Bluestem Alley,false,paypal,true,mobile
Enriqueta,475,wloded6@va.gov,wbockend6,Wilmer,wdunniond6@blogtalkradio.com,wpattemored6@sphinn.com,248-263-4829,imperdiet sapien urna pretium nisl ut volutpat sapien arcu sed augue aliquam erat,132.108.21.107,"Maecenas leo odio, condimentum id, luctus nec, molestie sed, justo. Pellentesque viverra pede ac diam. Cras pellentesque volutpat dui.

Maecenas tristique, est et tempus semper, est quam pharetra magna, ac consequat metus sapien ut nunc. Vestibulum ante ipsum primis in faucibus orci luctus et ultrices posuere cubilia Curae; Mauris viverra diam vitae quam. Suspendisse potenti.",7126.42,7/30/2022,3/23/2021,Id.ppt,00 Scofield Way,false,bitcoin,false,desktop
Hector,476,rgillebrided7@topsy.com,rbondleyd7,Robb,rbeilbyd7@booking.com,rjackalind7@cnbc.com,952-334-9681,justo morbi ut odio cras mi pede malesuada in imperdiet,17.136.248.63,"Integer ac leo. Pellentesque ultrices mattis odio. Donec vitae nisi.

Nam ultrices, libero non mattis pulvinar, nulla pede ullamcorper augue, a suscipit nulla elit ac nulla. Sed vel enim sit amet nunc viverra dapibus. Nulla suscipit ligula in lacus.",6284.9,7/10/2022,5/14/2022,VulputateLuctusCum.doc,28659 Forest Junction,true,paypal,true,desktop
Poul,477,ashotterd8@narod.ru,amaasd8,Alla,akeightleyd8@army.mil,acramerd8@issuu.com,838-144-8969,lobortis convallis tortor risus dapibus augue vel accumsan tellus nisi eu orci,152.185.207.247,Aliquam quis turpis eget elit sodales scelerisque. Mauris sit amet eros. Suspendisse accumsan tortor quis turpis.,9762.87,9/29/2022,8/28/2021,NislNunc.xls,4299 Independence Court,true,bitcoin,false,mobile
Bret,478,hellcomed9@google.pl,hgobeld9,Hatti,hchaudrond9@umich.edu,horriced9@dyndns.org,310-675-2044,nulla facilisi cras non velit nec nisi vulputate nonummy maecenas tincidunt lacus,211.98.74.240,"Suspendisse potenti. In eleifend quam a odio. In hac habitasse platea dictumst.

Maecenas ut massa quis augue luctus tincidunt. Nulla mollis molestie lorem. Quisque ut erat.

Curabitur gravida nisi at nibh. In hac habitasse platea dictumst. Aliquam augue quam, sollicitudin vitae, consectetuer eget, rutrum at, lorem.",8415.95,10/28/2022,10/4/2020,NullaEget.xls,2 Carberry Point,false,credit card,false,mobile
Eben,479,rtinmanda@ifeng.com,rchadburnda,Richard,rwhitleyda@free.fr,rholdronda@mapquest.com,965-762-6966,quis lectus suspendisse potenti in eleifend quam a odio in hac habitasse platea dictumst maecenas ut massa quis augue,29.229.219.171,"Aenean lectus. Pellentesque eget nunc. Donec quis orci eget orci vehicula condimentum.

Curabitur in libero ut massa volutpat convallis. Morbi odio odio, elementum eu, interdum eu, tincidunt in, leo. Maecenas pulvinar lobortis est.

Phasellus sit amet erat. Nulla tempus. Vivamus in felis eu sapien cursus vestibulum.",2096.14,9/12/2022,10/29/2022,Est.mp3,7991 International Crossing,false,paypal,true,mobile
Ethelred,480,bmacuchadairdb@house.gov,bgerhartzdb,Benedetta,bkisbeedb@amazonaws.com,bbenzingdb@businessweek.com,201-705-5091,ac diam cras pellentesque volutpat dui maecenas tristique est et tempus semper est quam pharetra magna ac consequat,123.74.183.59,"In sagittis dui vel nisl. Duis ac nibh. Fusce lacus purus, aliquet at, feugiat non, pretium quis, lectus.

Suspendisse potenti. In eleifend quam a odio. In hac habitasse platea dictumst.",4840.15,11/29/2022,8/31/2022,PedePosuereNonummy.jpeg,23 Melvin Center,false,bitcoin,false,desktop
Vinita,481,cbampkindc@com.com,cayerstdc,Clemmie,cechlindc@printfriendly.com,cruggendc@dailymotion.com,168-906-5138,ipsum primis in faucibus orci luctus et ultrices posuere cubilia curae mauris viverra diam vitae quam suspendisse,206.153.109.156,"Mauris enim leo, rhoncus sed, vestibulum sit amet, cursus id, turpis. Integer aliquet, massa id lobortis convallis, tortor risus dapibus augue, vel accumsan tellus nisi eu orci. Mauris lacinia sapien quis libero.

Nullam sit amet turpis elementum ligula vehicula consequat. Morbi a ipsum. Integer a nibh.

In quis justo. Maecenas rhoncus aliquam lacus. Morbi quis tortor id nulla ultrices aliquet.",7039.96,1/19/2022,5/5/2022,LectusPellentesque.ppt,9 Elka Road,false,paypal,true,mobile
Margeaux,482,sllorensdd@uiuc.edu,slittlerdd,Sigmund,sstaitdd@elpais.com,skorneevdd@tripadvisor.com,416-827-9501,in est risus auctor sed tristique in tempus sit amet sem fusce,134.134.244.200,"Fusce posuere felis sed lacus. Morbi sem mauris, laoreet ut, rhoncus aliquet, pulvinar sed, nisl. Nunc rhoncus dui vel sem.

Sed sagittis. Nam congue, risus semper porta volutpat, quam pede lobortis ligula, sit amet eleifend pede libero quis orci. Nullam molestie nibh in lectus.",82.86,12/5/2022,9/26/2021,PraesentBlanditLacinia.ppt,8 Canary Point,false,paypal,true,desktop
Renato,483,slegallede@nps.gov,sminshawde,Shae,scrootede@shareasale.com,scharnockde@instagram.com,555-793-5677,nec nisi vulputate nonummy maecenas tincidunt lacus at velit vivamus vel nulla eget eros elementum pellentesque quisque porta,144.71.220.136,"Morbi non lectus. Aliquam sit amet diam in magna bibendum imperdiet. Nullam orci pede, venenatis non, sodales sed, tincidunt eu, felis.

Fusce posuere felis sed lacus. Morbi sem mauris, laoreet ut, rhoncus aliquet, pulvinar sed, nisl. Nunc rhoncus dui vel sem.

Sed sagittis. Nam congue, risus semper porta volutpat, quam pede lobortis ligula, sit amet eleifend pede libero quis orci. Nullam molestie nibh in lectus.",7540.73,6/17/2022,5/30/2022,NullaAcEnim.avi,9 Sundown Trail,true,credit card,true,mobile
Cross,484,mlemonnierdf@jiathis.com,mgarzdf,Madeleine,mfrankdf@examiner.com,mhackerdf@wordpress.com,109-801-4319,posuere cubilia curae nulla dapibus dolor vel est donec odio justo sollicitudin ut,159.194.41.156,"Praesent id massa id nisl venenatis lacinia. Aenean sit amet justo. Morbi ut odio.

Cras mi pede, malesuada in, imperdiet et, commodo vulputate, justo. In blandit ultrices enim. Lorem ipsum dolor sit amet, consectetuer adipiscing elit.

Proin interdum mauris non ligula pellentesque ultrices. Phasellus id sapien in sapien iaculis congue. Vivamus metus arcu, adipiscing molestie, hendrerit at, vulputate vitae, nisl.",4614.29,8/25/2022,11/13/2020,Tortor.mp3,02499 Anthes Road,true,bitcoin,true,tablet
Caz,485,rschreinerdg@goo.gl,rchansonnaudg,Renae,rhansemanndg@columbia.edu,rpashendg@is.gd,317-596-9564,penatibus et magnis dis parturient montes nascetur ridiculus mus vivamus vestibulum sagittis sapien cum sociis natoque penatibus et,13.35.213.90,"Nam ultrices, libero non mattis pulvinar, nulla pede ullamcorper augue, a suscipit nulla elit ac nulla. Sed vel enim sit amet nunc viverra dapibus. Nulla suscipit ligula in lacus.",7649.65,8/13/2022,6/10/2020,Primis.xls,379 Debs Alley,false,paypal,false,desktop
Brade,486,fatheisdh@google.fr,fodeveydh,Fernande,fduckhousedh@intel.com,fhanlondh@parallels.com,465-733-8060,amet sapien dignissim vestibulum vestibulum ante ipsum primis in faucibus orci luctus et ultrices posuere,20.30.77.225,"Maecenas leo odio, condimentum id, luctus nec, molestie sed, justo. Pellentesque viverra pede ac diam. Cras pellentesque volutpat dui.",9606.48,4/27/2022,11/23/2021,IpsumDolorSit.xls,4763 Melody Place,false,credit card,true,mobile
Aldridge,487,hghirondi@odnoklassniki.ru,hbartalonidi,Hunt,hmcphatedi@auda.org.au,hjaycoxdi@amazon.com,732-993-2930,justo maecenas rhoncus aliquam lacus morbi quis tortor id nulla ultrices aliquet maecenas leo,90.90.56.56,"Integer ac leo. Pellentesque ultrices mattis odio. Donec vitae nisi.

Nam ultrices, libero non mattis pulvinar, nulla pede ullamcorper augue, a suscipit nulla elit ac nulla. Sed vel enim sit amet nunc viverra dapibus. Nulla suscipit ligula in lacus.

Curabitur at ipsum ac tellus semper interdum. Mauris ullamcorper purus sit amet nulla. Quisque arcu libero, rutrum ac, lobortis vel, dapibus at, diam.",6432.94,6/12/2022,6/26/2020,JustoEtiam.tiff,8136 Holmberg Place,false,bitcoin,false,desktop
Nahum,488,adidballdj@wsj.com,askadedj,Abbi,asteedendj@tmall.com,ajakoubdj@youku.com,675-452-8417,aenean auctor gravida sem praesent id massa id nisl venenatis lacinia aenean sit amet justo morbi ut odio cras mi,37.7.121.206,"Morbi non lectus. Aliquam sit amet diam in magna bibendum imperdiet. Nullam orci pede, venenatis non, sodales sed, tincidunt eu, felis.

Fusce posuere felis sed lacus. Morbi sem mauris, laoreet ut, rhoncus aliquet, pulvinar sed, nisl. Nunc rhoncus dui vel sem.",3574.11,1/31/2022,8/1/2022,SitAmetLobortis.doc,9539 Walton Lane,true,credit card,false,tablet
Lazare,489,rspreulldk@themeforest.net,rpoutondk,Rosaline,rnucatordk@dell.com,rhanmerdk@answers.com,877-855-5439,magnis dis parturient montes nascetur ridiculus mus vivamus vestibulum sagittis sapien cum sociis,21.14.77.152,"Praesent blandit. Nam nulla. Integer pede justo, lacinia eget, tincidunt eget, tempus vel, pede.

Morbi porttitor lorem id ligula. Suspendisse ornare consequat lectus. In est risus, auctor sed, tristique in, tempus sit amet, sem.

Fusce consequat. Nulla nisl. Nunc nisl.",2136.88,4/24/2022,8/10/2022,SitAmet.avi,1403 Rockefeller Circle,true,credit card,true,mobile
Penny,490,swattinhamdl@meetup.com,scapstickdl,Salli,salyutindl@google.pl,smalkindl@cloudflare.com,210-385-2980,sagittis dui vel nisl duis ac nibh fusce lacus purus aliquet at feugiat non pretium quis lectus suspendisse potenti in,129.67.177.225,"In congue. Etiam justo. Etiam pretium iaculis justo.

In hac habitasse platea dictumst. Etiam faucibus cursus urna. Ut tellus.

Nulla ut erat id mauris vulputate elementum. Nullam varius. Nulla facilisi.",8407.85,6/22/2022,4/4/2022,NecMolestie.mpeg,18422 Dahle Point,true,credit card,true,mobile
Jessa,491,gglendzadm@yandex.ru,gondrakdm,Grazia,gmayheaddm@google.com.hk,gsharperdm@surveymonkey.com,818-738-2914,mi integer ac neque duis bibendum morbi non quam nec dui luctus rutrum nulla tellus in sagittis dui,167.131.148.153,"Aliquam quis turpis eget elit sodales scelerisque. Mauris sit amet eros. Suspendisse accumsan tortor quis turpis.

Sed ante. Vivamus tortor. Duis mattis egestas metus.

Aenean fermentum. Donec ut mauris eget massa tempor convallis. Nulla neque libero, convallis eget, eleifend luctus, ultricies eu, nibh.",3406.51,7/23/2022,9/24/2022,FelisUt.mp3,517 Sachtjen Alley,true,bitcoin,false,desktop
Kat,492,jbuneydn@economist.com,jcowperthwaitedn,Jemmie,jberidn@biglobe.ne.jp,jivantyevdn@abc.net.au,783-631-2746,nisi vulputate nonummy maecenas tincidunt lacus at velit vivamus vel nulla eget,204.85.232.234,"Aenean lectus. Pellentesque eget nunc. Donec quis orci eget orci vehicula condimentum.

Curabitur in libero ut massa volutpat convallis. Morbi odio odio, elementum eu, interdum eu, tincidunt in, leo. Maecenas pulvinar lobortis est.

Phasellus sit amet erat. Nulla tempus. Vivamus in felis eu sapien cursus vestibulum.",4214.45,5/21/2022,10/4/2021,EuFelis.mp3,48 Del Mar Center,false,credit card,false,desktop
Cassie,493,lpiggremdo@moonfruit.com,ldinehartdo,Lorry,lfergussondo@flavors.me,lkarlolakdo@facebook.com,293-724-2514,diam id ornare imperdiet sapien urna pretium nisl ut volutpat sapien,167.213.30.70,"Quisque porta volutpat erat. Quisque erat eros, viverra eget, congue eget, semper rutrum, nulla. Nunc purus.",3310.42,2/17/2022,7/18/2021,SuspendissePotenti.ppt,3 Lillian Way,false,bitcoin,false,tablet
Melesa,494,cnowelldp@blogger.com,cjorondp,Colby,curedp@go.com,cpelldp@arizona.edu,753-937-3301,integer a nibh in quis justo maecenas rhoncus aliquam lacus morbi quis tortor,120.2.137.172,"Sed ante. Vivamus tortor. Duis mattis egestas metus.

Aenean fermentum. Donec ut mauris eget massa tempor convallis. Nulla neque libero, convallis eget, eleifend luctus, ultricies eu, nibh.",5499.22,2/9/2022,10/28/2021,Varius.xls,03718 Barby Trail,false,bitcoin,true,tablet
Lona,495,aoxtobydq@cdc.gov,abuckenhilldq,Anatola,aboscherdq@state.tx.us,avankovdq@creativecommons.org,639-145-7315,bibendum morbi non quam nec dui luctus rutrum nulla tellus in sagittis dui vel,170.149.128.62,Praesent id massa id nisl venenatis lacinia. Aenean sit amet justo. Morbi ut odio.,3877.47,9/13/2022,6/12/2021,FaucibusOrci.jpeg,36207 Moose Circle,true,credit card,true,mobile
Mason,496,challowsdr@amazon.co.jp,ctoundr,Carolina,chetterichdr@oaic.gov.au,cketteldr@quantcast.com,867-252-7591,massa id lobortis convallis tortor risus dapibus augue vel accumsan tellus nisi,143.22.17.74,"In hac habitasse platea dictumst. Morbi vestibulum, velit id pretium iaculis, diam erat fermentum justo, nec condimentum neque sapien placerat ante. Nulla justo.",9187.43,4/14/2022,5/21/2020,Suscipit.mov,78226 Waxwing Road,true,paypal,true,tablet
Maynord,497,jklynerds@biglobe.ne.jp,jmeakingds,Josepha,jploseds@ox.ac.uk,jhagueds@imgur.com,279-539-1466,quisque porta volutpat erat quisque erat eros viverra eget congue eget,15.161.163.1,"Duis aliquam convallis nunc. Proin at turpis a pede posuere nonummy. Integer non velit.

Donec diam neque, vestibulum eget, vulputate ut, ultrices vel, augue. Vestibulum ante ipsum primis in faucibus orci luctus et ultrices posuere cubilia Curae; Donec pharetra, magna vestibulum aliquet ultrices, erat tortor sollicitudin mi, sit amet lobortis sapien sapien non mi. Integer ac neque.

Duis bibendum. Morbi non quam nec dui luctus rutrum. Nulla tellus.",7421.63,11/14/2022,11/29/2020,A.ppt,7389 Morning Hill,false,bitcoin,false,mobile
Antony,498,abulforddt@spotify.com,aclaasendt,Amandy,atipensdt@bravesites.com,amclaffertydt@wikispaces.com,358-278-5649,leo maecenas pulvinar lobortis est phasellus sit amet erat nulla tempus vivamus in,18.215.44.124,"Fusce posuere felis sed lacus. Morbi sem mauris, laoreet ut, rhoncus aliquet, pulvinar sed, nisl. Nunc rhoncus dui vel sem.",9439.59,3/1/2022,9/4/2020,OrciLuctus.gif,0 Monica Avenue,true,credit card,false,desktop
Constancy,499,rcotheydu@sphinn.com,rpaybodydu,Rodger,rcastanonedu@baidu.com,rwelbourndu@nba.com,175-646-1294,ipsum primis in faucibus orci luctus et ultrices posuere cubilia curae duis,163.195.95.36,"Quisque porta volutpat erat. Quisque erat eros, viverra eget, congue eget, semper rutrum, nulla. Nunc purus.

Phasellus in felis. Donec semper sapien a libero. Nam dui.

Proin leo odio, porttitor id, consequat in, consequat ut, nulla. Sed accumsan felis. Ut at dolor quis odio consequat varius.",7356.19,1/11/2022,10/24/2022,Sociis.mp3,3399 Crescent Oaks Terrace,true,credit card,true,mobile
Wilton,500,gczajkowskadv@weebly.com,gbashamdv,Greg,gcroughandv@shinystat.com,ggerwooddv@accuweather.com,884-345-2366,quam nec dui luctus rutrum nulla tellus in sagittis dui vel nisl duis ac nibh fusce,232.94.22.112,"Morbi non lectus. Aliquam sit amet diam in magna bibendum imperdiet. Nullam orci pede, venenatis non, sodales sed, tincidunt eu, felis.

Fusce posuere felis sed lacus. Morbi sem mauris, laoreet ut, rhoncus aliquet, pulvinar sed, nisl. Nunc rhoncus dui vel sem.",9532.75,5/30/2022,6/12/2021,AtVulputateVitae.avi,4 Maywood Road,false,credit card,false,tablet
Curran,501,eescoffierdw@gnu.org,eoagdw,Em,ecurseydw@indiegogo.com,ecollickdw@pinterest.com,247-293-9248,lectus in quam fringilla rhoncus mauris enim leo rhoncus sed vestibulum sit amet cursus id turpis integer aliquet,235.94.75.165,"Quisque porta volutpat erat. Quisque erat eros, viverra eget, congue eget, semper rutrum, nulla. Nunc purus.",6506.12,5/11/2022,1/31/2020,VelNullaEget.avi,78 Mesta Avenue,true,bitcoin,true,tablet
Alfy,502,mickovitsdx@bing.com,mcastlakedx,Michail,malleynedx@geocities.jp,mkikkedx@bloglovin.com,660-251-7176,non mi integer ac neque duis bibendum morbi non quam nec dui luctus rutrum nulla tellus in sagittis dui vel,90.19.121.86,"Nullam sit amet turpis elementum ligula vehicula consequat. Morbi a ipsum. Integer a nibh.

In quis justo. Maecenas rhoncus aliquam lacus. Morbi quis tortor id nulla ultrices aliquet.

Maecenas leo odio, condimentum id, luctus nec, molestie sed, justo. Pellentesque viverra pede ac diam. Cras pellentesque volutpat dui.",2440.0,9/24/2022,8/30/2020,Risus.mp3,2925 Larry Parkway,true,credit card,false,tablet
Berni,503,hmacmakindy@is.gd,hbyrddy,Hinda,hdaensdy@goo.ne.jp,hlandrieudy@twitpic.com,380-718-4389,lacinia aenean sit amet justo morbi ut odio cras mi pede malesuada in imperdiet et commodo vulputate justo,136.95.174.194,"Vestibulum ac est lacinia nisi venenatis tristique. Fusce congue, diam id ornare imperdiet, sapien urna pretium nisl, ut volutpat sapien arcu sed augue. Aliquam erat volutpat.",7741.8,10/31/2022,2/26/2021,Ut.mp3,4 Gale Pass,true,bitcoin,true,tablet
