sender_name,user_id,sender_email,username,recipient_name,email,recipient_email,phone_number,subject,ip_address,message,transaction_amount,timestamp,transaction_date,attachment,shipping_address,is_read,payment_method,is_spam,device_type
Zach,730,jolink9@marketwatch.com,jjaqueminetk9,Jacquelin,jrattenberiek9@examiner.com,jtallynk9@cbc.ca,584-912-1433,lobortis vel dapibus at diam nam tristique tortor eu pede,244.146.137.158,"Quisque id justo sit amet sapien dignissim vestibulum. Vestibulum ante ipsum primis in faucibus orci luctus et ultrices posuere cubilia Curae; Nulla dapibus dolor vel est. Donec odio justo, sollicitudin ut, suscipit a, feugiat et, eros.

Vestibulum ac est lacinia nisi venenatis tristique. Fusce congue, diam id ornare imperdiet, sapien urna pretium nisl, ut volutpat sapien arcu sed augue. Aliquam erat volutpat.",3585.12,2/6/2022,3/21/2020,NasceturRidiculus.mp3,454 Kim Alley,true,bitcoin,true,tablet
Rozelle,731,mtowerka@webs.com,mordka,Maure,mwranklingka@yellowbook.com,mstitfallka@histats.com,223-688-3461,elit ac nulla sed vel enim sit amet nunc viverra dapibus nulla suscipit ligula in lacus curabitur at,120.155.233.229,"Nullam sit amet turpis elementum ligula vehicula consequat. Morbi a ipsum. Integer a nibh.

In quis justo. Maecenas rhoncus aliquam lacus. Morbi quis tortor id nulla ultrices aliquet.

Maecenas leo odio, condimentum id, luctus nec, molestie sed, justo. Pellentesque viverra pede ac diam. Cras pellentesque volutpat dui.",6864.01,7/4/2022,1/25/2021,Rutrum.avi,21178 Shopko Trail,false,paypal,true,tablet
Hall,732,kwabersinkekb@dion.ne.jp,kflightkb,Kristal,kmachelkb@123-reg.co.uk,kbattersonkb@bluehost.com,672-350-3245,eget congue eget semper rutrum nulla nunc purus phasellus in felis,162.109.243.253,"Nullam porttitor lacus at turpis. Donec posuere metus vitae ipsum. Aliquam non mauris.

Morbi non lectus. Aliquam sit amet diam in magna bibendum imperdiet. Nullam orci pede, venenatis non, sodales sed, tincidunt eu, felis.

Fusce posuere felis sed lacus. Morbi sem mauris, laoreet ut, rhoncus aliquet, pulvinar sed, nisl. Nunc rhoncus dui vel sem.",8933.17,8/25/2022,8/16/2021,NamNulla.avi,6335 Rusk Center,true,paypal,true,mobile
Sybille,733,zsabbinskc@mac.com,zgoftonkc,Zaneta,zbutterykc@mediafire.com,zpresshaughkc@google.com.br,988-935-0786,eget elit sodales scelerisque mauris sit amet eros suspendisse accumsan tortor quis turpis sed ante vivamus tortor duis mattis,152.40.203.211,"Praesent blandit. Nam nulla. Integer pede justo, lacinia eget, tincidunt eget, tempus vel, pede.

Morbi porttitor lorem id ligula. Suspendisse ornare consequat lectus. In est risus, auctor sed, tristique in, tempus sit amet, sem.",6193.64,5/31/2022,1/25/2022,UtBlandit.ppt,6877 Schmedeman Center,true,bitcoin,false,mobile
Elnore,734,mtibbkd@parallels.com,mcottamkd,Mackenzie,mbettekd@soundcloud.com,mfitchellkd@wiley.com,691-328-6397,pede malesuada in imperdiet et commodo vulputate justo in blandit ultrices enim lorem ipsum dolor sit amet consectetuer,195.88.101.48,"Integer ac leo. Pellentesque ultrices mattis odio. Donec vitae nisi.

Nam ultrices, libero non mattis pulvinar, nulla pede ullamcorper augue, a suscipit nulla elit ac nulla. Sed vel enim sit amet nunc viverra dapibus. Nulla suscipit ligula in lacus.",7478.73,5/26/2022,1/28/2022,PellentesqueQuisque.png,18361 Donald Place,true,credit card,true,desktop
Hobard,735,sobertke@princeton.edu,scasemoreke,Salome,smccallisterke@slashdot.org,saxtellke@angelfire.com,428-815-9973,suscipit nulla elit ac nulla sed vel enim sit amet,196.88.210.120,"Morbi porttitor lorem id ligula. Suspendisse ornare consequat lectus. In est risus, auctor sed, tristique in, tempus sit amet, sem.",2370.1,4/22/2022,11/27/2020,Primis.txt,3343 Melody Crossing,false,bitcoin,false,desktop
Janek,736,kpesticciokf@goo.gl,kdegnenkf,Koressa,klancastlekf@boston.com,kthongerkf@thetimes.co.uk,967-203-8109,semper interdum mauris ullamcorper purus sit amet nulla quisque arcu libero rutrum ac lobortis vel dapibus at,210.138.27.94,"Fusce posuere felis sed lacus. Morbi sem mauris, laoreet ut, rhoncus aliquet, pulvinar sed, nisl. Nunc rhoncus dui vel sem.

Sed sagittis. Nam congue, risus semper porta volutpat, quam pede lobortis ligula, sit amet eleifend pede libero quis orci. Nullam molestie nibh in lectus.",7264.89,11/10/2022,8/15/2020,AtNulla.gif,28 Gina Parkway,true,credit card,false,tablet
Carline,737,tewartkg@so-net.ne.jp,teneaskg,Tania,tianiellokg@soup.io,tjerminkg@elpais.com,126-808-9085,lacinia nisi venenatis tristique fusce congue diam id ornare imperdiet sapien urna pretium nisl ut volutpat sapien arcu sed,235.113.85.147,"Vestibulum ac est lacinia nisi venenatis tristique. Fusce congue, diam id ornare imperdiet, sapien urna pretium nisl, ut volutpat sapien arcu sed augue. Aliquam erat volutpat.",3578.57,2/20/2022,1/31/2021,RisusDapibusAugue.png,1 Acker Center,false,credit card,true,tablet
Amby,738,kjoutapaviciuskh@soundcloud.com,kgabbotkh,Kimbra,kdunstankh@spotify.com,kpeschkakh@blogger.com,506-852-7610,urna pretium nisl ut volutpat sapien arcu sed augue aliquam erat volutpat in,79.94.226.247,Phasellus sit amet erat. Nulla tempus. Vivamus in felis eu sapien cursus vestibulum.,113.22,5/11/2022,12/23/2021,EuOrci.mp3,611 Debra Avenue,true,bitcoin,false,desktop
Sunny,739,tcourtneyki@sbwire.com,tharrymanki,Tracey,tstowki@youku.com,thabornki@ocn.ne.jp,625-138-3553,at turpis a pede posuere nonummy integer non velit donec diam,6.16.213.13,Phasellus in felis. Donec semper sapien a libero. Nam dui.,2062.59,3/10/2022,11/23/2020,Posuere.tiff,0 Carberry Alley,false,credit card,true,tablet
Kalil,740,kgeaterkj@joomla.org,kcurwenkj,Kate,kstanhopekj@theguardian.com,krodgerskj@php.net,584-864-5725,magna ac consequat metus sapien ut nunc vestibulum ante ipsum primis in faucibus orci luctus,219.172.63.70,"Fusce posuere felis sed lacus. Morbi sem mauris, laoreet ut, rhoncus aliquet, pulvinar sed, nisl. Nunc rhoncus dui vel sem.

Sed sagittis. Nam congue, risus semper porta volutpat, quam pede lobortis ligula, sit amet eleifend pede libero quis orci. Nullam molestie nibh in lectus.

Pellentesque at nulla. Suspendisse potenti. Cras in purus eu magna vulputate luctus.",8510.21,1/17/2022,10/9/2022,DapibusNulla.tiff,844 Hudson Place,false,credit card,true,desktop
Tobiah,741,nwillcockskk@imageshack.us,ngedgekk,Nancy,nkrysztofowiczkk@economist.com,nneaveskk@cafepress.com,174-757-9797,urna ut tellus nulla ut erat id mauris vulputate elementum,80.219.49.30,"Curabitur gravida nisi at nibh. In hac habitasse platea dictumst. Aliquam augue quam, sollicitudin vitae, consectetuer eget, rutrum at, lorem.",5178.58,9/4/2022,7/6/2021,UtBlandit.jpeg,3 Arizona Parkway,true,credit card,true,tablet
Tadd,742,dpaolinokl@friendfeed.com,dvynollkl,Dom,dcrowcroftkl@omniture.com,drobeirokl@hatena.ne.jp,744-294-8724,morbi porttitor lorem id ligula suspendisse ornare consequat lectus in est risus auctor,140.41.90.49,"Donec diam neque, vestibulum eget, vulputate ut, ultrices vel, augue. Vestibulum ante ipsum primis in faucibus orci luctus et ultrices posuere cubilia Curae; Donec pharetra, magna vestibulum aliquet ultrices, erat tortor sollicitudin mi, sit amet lobortis sapien sapien non mi. Integer ac neque.

Duis bibendum. Morbi non quam nec dui luctus rutrum. Nulla tellus.

In sagittis dui vel nisl. Duis ac nibh. Fusce lacus purus, aliquet at, feugiat non, pretium quis, lectus.",4728.36,9/5/2022,12/22/2021,EuismodScelerisqueQuam.jpeg,141 Lighthouse Bay Terrace,false,bitcoin,false,tablet
Casper,743,efoxtenkm@kickstarter.com,ecraigkm,Estella,ephettiplacekm@npr.org,etrinkekm@squarespace.com,574-111-7794,posuere felis sed lacus morbi sem mauris laoreet ut rhoncus aliquet pulvinar sed nisl,8.180.176.134,"Etiam vel augue. Vestibulum rutrum rutrum neque. Aenean auctor gravida sem.

Praesent id massa id nisl venenatis lacinia. Aenean sit amet justo. Morbi ut odio.

Cras mi pede, malesuada in, imperdiet et, commodo vulputate, justo. In blandit ultrices enim. Lorem ipsum dolor sit amet, consectetuer adipiscing elit.",5004.81,3/3/2022,11/20/2022,Pharetra.mp3,86691 Warner Pass,false,bitcoin,true,mobile
Taffy,744,zayerstkn@over-blog.com,zpillanskn,Zorah,zmcvanekn@google.co.uk,zjirkakn@i2i.jp,314-513-4342,sapien placerat ante nulla justo aliquam quis turpis eget elit sodales scelerisque mauris sit amet eros suspendisse,133.54.52.82,Sed ante. Vivamus tortor. Duis mattis egestas metus.,7478.12,5/18/2022,7/30/2022,QuisquePortaVolutpat.xls,975 Esch Circle,true,paypal,false,desktop
Martainn,745,ajaradko@nasa.gov,aguillouxko,Annis,aalldredko@fc2.com,afirpiko@patch.com,584-260-2364,dui luctus rutrum nulla tellus in sagittis dui vel nisl duis ac nibh fusce lacus purus,14.138.231.134,Maecenas ut massa quis augue luctus tincidunt. Nulla mollis molestie lorem. Quisque ut erat.,3330.75,1/5/2022,2/23/2022,Nisi.ppt,4 Prentice Circle,false,credit card,false,tablet
Godiva,746,bshearerkp@goo.gl,bjoicekp,Benita,bcavalierkp@google.pl,bgeekiekp@yellowbook.com,281-454-7178,montes nascetur ridiculus mus etiam vel augue vestibulum rutrum rutrum neque aenean auctor gravida sem praesent id massa id,211.7.145.50,Etiam vel augue. Vestibulum rutrum rutrum neque. Aenean auctor gravida sem.,9057.17,5/29/2022,6/13/2021,VenenatisNonSodales.ppt,65104 Dunning Hill,true,paypal,true,desktop
Broderic,747,svintkq@elpais.com,swordsworthkq,Sigismondo,sbowcockkq@over-blog.com,sconduitkq@upenn.edu,153-382-3185,vestibulum eget vulputate ut ultrices vel augue vestibulum ante ipsum primis in faucibus orci luctus et ultrices posuere,5.138.84.39,"Integer tincidunt ante vel ipsum. Praesent blandit lacinia erat. Vestibulum sed magna at nunc commodo placerat.

Praesent blandit. Nam nulla. Integer pede justo, lacinia eget, tincidunt eget, tempus vel, pede.",3925.23,11/5/2022,4/6/2021,PulvinarNulla.mp3,412 Dexter Hill,true,bitcoin,true,tablet
Cristionna,748,blunakr@instagram.com,bhirthkr,Benjie,bdonnellankr@twitpic.com,bromushkinkr@columbia.edu,224-440-5365,mauris ullamcorper purus sit amet nulla quisque arcu libero rutrum ac lobortis vel dapibus at,21.109.29.216,"Cum sociis natoque penatibus et magnis dis parturient montes, nascetur ridiculus mus. Vivamus vestibulum sagittis sapien. Cum sociis natoque penatibus et magnis dis parturient montes, nascetur ridiculus mus.",1521.81,6/3/2022,4/15/2020,AugueQuam.avi,38397 Esker Plaza,true,paypal,false,desktop
Chastity,749,llewsonks@ucoz.ru,lpuckinghorneks,Lynda,lraoultks@example.com,lperfiliks@networksolutions.com,892-662-5342,interdum mauris non ligula pellentesque ultrices phasellus id sapien in sapien iaculis congue vivamus,0.69.250.251,"Nullam sit amet turpis elementum ligula vehicula consequat. Morbi a ipsum. Integer a nibh.

In quis justo. Maecenas rhoncus aliquam lacus. Morbi quis tortor id nulla ultrices aliquet.

Maecenas leo odio, condimentum id, luctus nec, molestie sed, justo. Pellentesque viverra pede ac diam. Cras pellentesque volutpat dui.",4749.9,7/24/2022,11/12/2022,Elit.avi,29 Prairieview Street,true,credit card,false,mobile
Koenraad,750,bmatyaskt@google.co.uk,bscramagekt,Benson,bcapenorkt@hubpages.com,bfollittkt@wikipedia.org,363-899-1122,rhoncus mauris enim leo rhoncus sed vestibulum sit amet cursus id turpis integer aliquet massa id lobortis,87.100.122.59,Phasellus in felis. Donec semper sapien a libero. Nam dui.,7084.27,7/17/2022,8/8/2020,OrciLuctus.ppt,600 Fulton Court,false,credit card,false,desktop
Klarika,751,bpasticznykku@dyndns.org,bmcgeeku,Bart,bdumbletonku@drupal.org,bboiceku@freewebs.com,522-539-4123,duis mattis egestas metus aenean fermentum donec ut mauris eget massa tempor convallis nulla neque libero,100.81.206.232,"Etiam vel augue. Vestibulum rutrum rutrum neque. Aenean auctor gravida sem.

Praesent id massa id nisl venenatis lacinia. Aenean sit amet justo. Morbi ut odio.

Cras mi pede, malesuada in, imperdiet et, commodo vulputate, justo. In blandit ultrices enim. Lorem ipsum dolor sit amet, consectetuer adipiscing elit.",5552.03,2/15/2022,2/22/2022,ConsequatMetusSapien.xls,1756 Atwood Alley,false,paypal,false,desktop
Hermon,752,cstarckskv@ft.com,cpeacopkv,Christian,ccamilikv@cbslocal.com,codonovankv@elpais.com,513-100-2768,hendrerit at vulputate vitae nisl aenean lectus pellentesque eget nunc donec quis orci eget orci vehicula condimentum curabitur,55.157.235.154,"Fusce posuere felis sed lacus. Morbi sem mauris, laoreet ut, rhoncus aliquet, pulvinar sed, nisl. Nunc rhoncus dui vel sem.

Sed sagittis. Nam congue, risus semper porta volutpat, quam pede lobortis ligula, sit amet eleifend pede libero quis orci. Nullam molestie nibh in lectus.

Pellentesque at nulla. Suspendisse potenti. Cras in purus eu magna vulputate luctus.",1849.87,6/13/2022,10/10/2022,AeneanAuctorGravida.xls,7 Saint Paul Junction,true,paypal,false,tablet
Rustin,753,eismaykw@php.net,epooleykw,Eldridge,ezielinskikw@jalbum.net,ewillisonkw@ft.com,645-481-5183,tortor duis mattis egestas metus aenean fermentum donec ut mauris eget massa tempor convallis nulla neque,12.49.206.83,"Aliquam quis turpis eget elit sodales scelerisque. Mauris sit amet eros. Suspendisse accumsan tortor quis turpis.

Sed ante. Vivamus tortor. Duis mattis egestas metus.",8624.01,11/4/2022,9/12/2021,At.gif,28719 Marquette Alley,true,paypal,true,desktop
Deirdre,754,fgerriessenkx@reuters.com,fgrayshankx,Fancy,ffrenschkx@about.me,fshirtcliffekx@ucoz.ru,300-198-1052,duis consequat dui nec nisi volutpat eleifend donec ut dolor morbi,138.16.35.114,"Maecenas leo odio, condimentum id, luctus nec, molestie sed, justo. Pellentesque viverra pede ac diam. Cras pellentesque volutpat dui.",4309.01,9/30/2022,7/21/2022,Ultrices.mp3,2 Lerdahl Pass,false,bitcoin,false,tablet
Leila,755,aloddenky@xrea.com,apeceyky,Angeli,abadbyky@gmpg.org,afeakky@scientificamerican.com,323-268-6251,ipsum integer a nibh in quis justo maecenas rhoncus aliquam lacus morbi quis,46.178.222.180,"In congue. Etiam justo. Etiam pretium iaculis justo.

In hac habitasse platea dictumst. Etiam faucibus cursus urna. Ut tellus.

Nulla ut erat id mauris vulputate elementum. Nullam varius. Nulla facilisi.",544.96,3/10/2022,8/25/2021,RhoncusMaurisEnim.png,8227 Carey Hill,false,bitcoin,true,mobile
Noel,756,cbrownsworthkz@webnode.com,cwaitonkz,Cori,clefridgekz@posterous.com,cblownkz@cargocollective.com,651-864-2674,eu nibh quisque id justo sit amet sapien dignissim vestibulum,215.44.111.48,"Praesent blandit. Nam nulla. Integer pede justo, lacinia eget, tincidunt eget, tempus vel, pede.

Morbi porttitor lorem id ligula. Suspendisse ornare consequat lectus. In est risus, auctor sed, tristique in, tempus sit amet, sem.

Fusce consequat. Nulla nisl. Nunc nisl.",2974.29,10/5/2022,10/17/2022,AnteVestibulumAnte.xls,0244 Westerfield Road,true,credit card,false,mobile
Onofredo,757,rboyackl0@slideshare.net,rtamblynl0,Renee,rkaddl0@digg.com,rfelgatel0@cbc.ca,869-259-2249,et magnis dis parturient montes nascetur ridiculus mus vivamus vestibulum sagittis sapien cum sociis natoque penatibus et magnis,182.253.172.204,"Fusce consequat. Nulla nisl. Nunc nisl.

Duis bibendum, felis sed interdum venenatis, turpis enim blandit mi, in porttitor pede justo eu massa. Donec dapibus. Duis at velit eu est congue elementum.",3131.73,4/5/2022,2/16/2021,CongueDiamId.png,2 Meadow Ridge Pass,false,paypal,false,desktop
Edie,758,gguppiel1@is.gd,gmontacutel1,Gregg,gkyndredl1@gravatar.com,gstacyl1@arstechnica.com,819-164-5890,curae donec pharetra magna vestibulum aliquet ultrices erat tortor sollicitudin mi,146.26.69.252,"Maecenas tristique, est et tempus semper, est quam pharetra magna, ac consequat metus sapien ut nunc. Vestibulum ante ipsum primis in faucibus orci luctus et ultrices posuere cubilia Curae; Mauris viverra diam vitae quam. Suspendisse potenti.

Nullam porttitor lacus at turpis. Donec posuere metus vitae ipsum. Aliquam non mauris.",4074.03,7/29/2022,11/19/2021,Lorem.avi,3492 Onsgard Point,false,credit card,true,tablet
Shay,759,cluardl2@ibm.com,cstendelll2,Corey,cclerkel2@bing.com,cnettlesl2@de.vu,181-615-7135,justo in hac habitasse platea dictumst etiam faucibus cursus urna ut tellus nulla ut,88.79.252.64,Aliquam quis turpis eget elit sodales scelerisque. Mauris sit amet eros. Suspendisse accumsan tortor quis turpis.,7261.73,5/11/2022,11/2/2020,ElementumIn.mpeg,9 Village Green Hill,false,credit card,false,mobile
Rhona,760,bstitwelll3@virginia.edu,bsantil3,Blancha,bstanyardl3@behance.net,bgarzal3@4shared.com,481-565-9313,ipsum primis in faucibus orci luctus et ultrices posuere cubilia curae duis faucibus,182.143.126.2,"Donec diam neque, vestibulum eget, vulputate ut, ultrices vel, augue. Vestibulum ante ipsum primis in faucibus orci luctus et ultrices posuere cubilia Curae; Donec pharetra, magna vestibulum aliquet ultrices, erat tortor sollicitudin mi, sit amet lobortis sapien sapien non mi. Integer ac neque.",8371.57,12/25/2022,7/2/2021,Velit.xls,4549 Merrick Terrace,false,paypal,true,mobile
Hakeem,761,squinceyl4@virginia.edu,sleversonl4,Stanley,sbonefantl4@npr.org,smatusiakl4@dailymail.co.uk,269-705-6421,amet nulla quisque arcu libero rutrum ac lobortis vel dapibus at diam nam tristique tortor eu,50.208.146.179,"Proin interdum mauris non ligula pellentesque ultrices. Phasellus id sapien in sapien iaculis congue. Vivamus metus arcu, adipiscing molestie, hendrerit at, vulputate vitae, nisl.",9490.27,1/24/2022,1/28/2021,Quis.tiff,181 Walton Plaza,false,bitcoin,false,tablet
Stevana,762,emityakovl5@infoseek.co.jp,enighl5,Esra,ejemisonl5@economist.com,esmuthl5@ovh.net,800-574-8643,odio justo sollicitudin ut suscipit a feugiat et eros vestibulum ac est lacinia nisi,151.34.124.166,"Aenean fermentum. Donec ut mauris eget massa tempor convallis. Nulla neque libero, convallis eget, eleifend luctus, ultricies eu, nibh.",7213.57,8/4/2022,10/31/2020,SitAmetDiam.ppt,2 Summit Drive,true,bitcoin,true,mobile
Dorthea,763,jshutlel6@nationalgeographic.com,jsnasdelll6,Julina,jcossingtonl6@unicef.org,jwattersonl6@posterous.com,206-930-4430,elit proin interdum mauris non ligula pellentesque ultrices phasellus id sapien in,187.111.0.210,"In sagittis dui vel nisl. Duis ac nibh. Fusce lacus purus, aliquet at, feugiat non, pretium quis, lectus.

Suspendisse potenti. In eleifend quam a odio. In hac habitasse platea dictumst.

Maecenas ut massa quis augue luctus tincidunt. Nulla mollis molestie lorem. Quisque ut erat.",3077.18,2/21/2022,7/13/2022,ErosVestibulum.mpeg,30 Emmet Trail,false,paypal,true,mobile
Trudy,764,gprinnel7@admin.ch,gkenwrickl7,Ginger,gbettridgel7@amazon.co.uk,gcranshawl7@mysql.com,540-122-7345,metus sapien ut nunc vestibulum ante ipsum primis in faucibus orci luctus et ultrices posuere cubilia curae,104.190.168.90,Cras non velit nec nisi vulputate nonummy. Maecenas tincidunt lacus at velit. Vivamus vel nulla eget eros elementum pellentesque.,7040.16,9/16/2022,8/10/2022,PurusPhasellus.mp3,50 Kinsman Way,true,paypal,true,tablet
Sol,765,acapinettil8@blogs.com,asailorl8,Avrit,aakkerl8@usgs.gov,akubistal8@smh.com.au,985-934-8436,dictumst etiam faucibus cursus urna ut tellus nulla ut erat id mauris vulputate,70.195.134.93,Duis bibendum. Morbi non quam nec dui luctus rutrum. Nulla tellus.,859.39,9/21/2022,10/10/2021,PraesentIdMassa.xls,84 Scott Junction,false,credit card,false,mobile
Shelton,766,wgreeningl9@freewebs.com,wkennanl9,Wilhelmine,wcutridgel9@unc.edu,wchristoll9@hud.gov,935-331-7112,mauris non ligula pellentesque ultrices phasellus id sapien in sapien iaculis congue vivamus metus,187.191.166.236,"Integer tincidunt ante vel ipsum. Praesent blandit lacinia erat. Vestibulum sed magna at nunc commodo placerat.

Praesent blandit. Nam nulla. Integer pede justo, lacinia eget, tincidunt eget, tempus vel, pede.

Morbi porttitor lorem id ligula. Suspendisse ornare consequat lectus. In est risus, auctor sed, tristique in, tempus sit amet, sem.",7091.56,11/5/2022,11/21/2020,Nisi.jpeg,3303 Hermina Junction,false,bitcoin,false,desktop
Bent,767,bchaffeyla@mapy.cz,bbedwellla,Bartolomeo,bcarbryla@nbcnews.com,bhendonsonla@arizona.edu,355-277-8659,nec condimentum neque sapien placerat ante nulla justo aliquam quis turpis eget,71.175.81.60,"Duis bibendum. Morbi non quam nec dui luctus rutrum. Nulla tellus.

In sagittis dui vel nisl. Duis ac nibh. Fusce lacus purus, aliquet at, feugiat non, pretium quis, lectus.

Suspendisse potenti. In eleifend quam a odio. In hac habitasse platea dictumst.",2966.07,10/26/2022,4/12/2021,BlanditNonInterdum.doc,22392 Lyons Circle,true,credit card,false,tablet
Boonie,768,gwestriplb@pen.io,gtofftslb,Gualterio,gduranlb@buzzfeed.com,gfeatherstonelb@ca.gov,683-169-1998,gravida nisi at nibh in hac habitasse platea dictumst aliquam augue quam sollicitudin,104.149.171.220,"Maecenas leo odio, condimentum id, luctus nec, molestie sed, justo. Pellentesque viverra pede ac diam. Cras pellentesque volutpat dui.",3913.2,7/16/2022,6/21/2022,Ante.avi,16489 West Avenue,false,credit card,true,mobile
Darda,769,aalldredlc@smh.com.au,apankethmanlc,Arden,apettislc@example.com,aflaxmanlc@mayoclinic.com,188-723-0050,nonummy maecenas tincidunt lacus at velit vivamus vel nulla eget eros,10.114.126.27,"Maecenas ut massa quis augue luctus tincidunt. Nulla mollis molestie lorem. Quisque ut erat.

Curabitur gravida nisi at nibh. In hac habitasse platea dictumst. Aliquam augue quam, sollicitudin vitae, consectetuer eget, rutrum at, lorem.",3666.25,2/4/2022,9/25/2022,IdLuctusNec.ppt,0735 3rd Alley,true,paypal,false,tablet
Gibby,770,gbrabantld@huffingtonpost.com,gicomld,Glyn,gelsomld@google.it,gpillingtonld@360.cn,589-160-1388,quis orci eget orci vehicula condimentum curabitur in libero ut massa volutpat convallis morbi odio odio elementum eu interdum eu,157.34.239.189,"Cum sociis natoque penatibus et magnis dis parturient montes, nascetur ridiculus mus. Vivamus vestibulum sagittis sapien. Cum sociis natoque penatibus et magnis dis parturient montes, nascetur ridiculus mus.

Etiam vel augue. Vestibulum rutrum rutrum neque. Aenean auctor gravida sem.

Praesent id massa id nisl venenatis lacinia. Aenean sit amet justo. Morbi ut odio.",6060.35,8/20/2022,5/22/2021,LobortisVel.pdf,1 Oakridge Alley,true,paypal,false,mobile
Alvinia,771,mwherritle@nhs.uk,mcosensle,Maisey,mspornerle@trellian.com,mjaradle@marketwatch.com,913-512-9495,fusce lacus purus aliquet at feugiat non pretium quis lectus suspendisse potenti in eleifend quam a odio in hac habitasse,69.178.108.75,"Proin leo odio, porttitor id, consequat in, consequat ut, nulla. Sed accumsan felis. Ut at dolor quis odio consequat varius.

Integer ac leo. Pellentesque ultrices mattis odio. Donec vitae nisi.",3946.93,11/8/2022,12/2/2022,DuiProinLeo.mp3,751 Rowland Crossing,true,paypal,false,tablet
Torrey,772,kstedelllf@vinaora.com,kbucknalllf,Keene,kmcsporonlf@blogger.com,ksawelllf@themeforest.net,103-276-4978,nibh in quis justo maecenas rhoncus aliquam lacus morbi quis tortor id nulla,233.13.196.25,"Duis bibendum. Morbi non quam nec dui luctus rutrum. Nulla tellus.

In sagittis dui vel nisl. Duis ac nibh. Fusce lacus purus, aliquet at, feugiat non, pretium quis, lectus.

Suspendisse potenti. In eleifend quam a odio. In hac habitasse platea dictumst.",9265.78,1/9/2022,10/10/2021,UltricesErat.mov,78469 Amoth Point,false,bitcoin,false,mobile
Francesco,773,wnelmeslg@cpanel.net,wdebenhamlg,Wilow,wchalfontlg@yahoo.com,wjurkiewiczlg@craigslist.org,188-545-0133,vestibulum rutrum rutrum neque aenean auctor gravida sem praesent id massa id nisl venenatis,169.233.16.204,"Donec diam neque, vestibulum eget, vulputate ut, ultrices vel, augue. Vestibulum ante ipsum primis in faucibus orci luctus et ultrices posuere cubilia Curae; Donec pharetra, magna vestibulum aliquet ultrices, erat tortor sollicitudin mi, sit amet lobortis sapien sapien non mi. Integer ac neque.

Duis bibendum. Morbi non quam nec dui luctus rutrum. Nulla tellus.

In sagittis dui vel nisl. Duis ac nibh. Fusce lacus purus, aliquet at, feugiat non, pretium quis, lectus.",8914.38,12/15/2022,9/22/2020,LeoMaecenas.mp3,28 Brown Center,false,credit card,false,tablet
Fifine,774,abelhamlh@sun.com,aambroschlh,Antonetta,aschenkellh@desdev.cn,amartynslh@google.ru,718-847-7723,ante vel ipsum praesent blandit lacinia erat vestibulum sed magna at nunc commodo placerat praesent blandit nam nulla integer,33.157.222.27,"Proin eu mi. Nulla ac enim. In tempor, turpis nec euismod scelerisque, quam turpis adipiscing lorem, vitae mattis nibh ligula nec sem.",8050.53,5/3/2022,11/19/2020,ElitProinRisus.xls,32 Shopko Place,true,paypal,false,desktop
Emmie,775,spentelowli@japanpost.jp,stregidoli,Skip,skeysallli@360.cn,sbinksli@bloomberg.com,840-885-5840,potenti cras in purus eu magna vulputate luctus cum sociis natoque penatibus et,73.9.248.254,"Cum sociis natoque penatibus et magnis dis parturient montes, nascetur ridiculus mus. Vivamus vestibulum sagittis sapien. Cum sociis natoque penatibus et magnis dis parturient montes, nascetur ridiculus mus.

Etiam vel augue. Vestibulum rutrum rutrum neque. Aenean auctor gravida sem.",5219.12,6/3/2022,5/31/2020,Nonummy.jpeg,083 Barby Lane,true,credit card,true,mobile
Carmencita,776,ghuckstepplj@dedecms.com,gcundictlj,Goraud,gmerwelj@biblegateway.com,gincognalj@salon.com,775-228-3676,quis turpis eget elit sodales scelerisque mauris sit amet eros suspendisse accumsan tortor quis,213.106.31.21,"Fusce consequat. Nulla nisl. Nunc nisl.

Duis bibendum, felis sed interdum venenatis, turpis enim blandit mi, in porttitor pede justo eu massa. Donec dapibus. Duis at velit eu est congue elementum.

In hac habitasse platea dictumst. Morbi vestibulum, velit id pretium iaculis, diam erat fermentum justo, nec condimentum neque sapien placerat ante. Nulla justo.",3530.86,11/24/2022,2/13/2022,Odio.xls,99 Washington Place,false,bitcoin,false,tablet
