sender_name,user_id,sender_email,username,recipient_name,email,recipient_email,phone_number,subject,ip_address,message,transaction_amount,timestamp,transaction_date,attachment,shipping_address,is_read,payment_method,is_spam,device_type
Jesselyn,1,cgriswaite0@blinklist.com,csummerley0,Carry,cprimett0@angelfire.com,cdavio0@multiply.com,885-844-3380,cursus vestibulum proin eu mi nulla ac enim in tempor turpis nec euismod scelerisque quam turpis adipiscing lorem vitae,140.22.153.188,"In sagittis dui vel nisl. Duis ac nibh. Fusce lacus purus, aliquet at, feugiat non, pretium quis, lectus.

Suspendisse potenti. In eleifend quam a odio. In hac habitasse platea dictumst.

Maecenas ut massa quis augue luctus tincidunt. Nulla mollis molestie lorem. Quisque ut erat.",8402.71,9/24/2022,12/5/2022,AmetConsectetuerAdipiscing.ppt,15 Armistice Park,false,bitcoin,false,mobile
Hyman,2,bflecknoe1@networksolutions.com,bbareham1,Brenn,bcranna1@google.cn,bstockley1@telegraph.co.uk,194-447-0656,ipsum primis in faucibus orci luctus et ultrices posuere cubilia curae duis faucibus accumsan odio,113.154.237.191,"Quisque porta volutpat erat. Quisque erat eros, viverra eget, congue eget, semper rutrum, nulla. Nunc purus.

Phasellus in felis. Donec semper sapien a libero. Nam dui.

Proin leo odio, porttitor id, consequat in, consequat ut, nulla. Sed accumsan felis. Ut at dolor quis odio consequat varius.",2564.39,4/2/2022,1/20/2022,CubiliaCurae.pdf,43726 Redwing Junction,true,bitcoin,false,tablet
Yoshiko,3,njonson2@marriott.com,nwillock2,Norah,ndisbrow2@icq.com,ngandey2@gov.uk,511-649-0946,augue quam sollicitudin vitae consectetuer eget rutrum at lorem integer tincidunt ante vel,135.217.235.189,"Phasellus sit amet erat. Nulla tempus. Vivamus in felis eu sapien cursus vestibulum.

Proin eu mi. Nulla ac enim. In tempor, turpis nec euismod scelerisque, quam turpis adipiscing lorem, vitae mattis nibh ligula nec sem.

Duis aliquam convallis nunc. Proin at turpis a pede posuere nonummy. Integer non velit.",3632.33,10/7/2022,2/29/2020,Ipsum.doc,07 Dexter Pass,false,paypal,true,mobile
Chen,4,jcaveau3@simplemachines.org,jshatliff3,Javier,jstronach3@example.com,jhebborn3@cnbc.com,207-513-1229,in imperdiet et commodo vulputate justo in blandit ultrices enim,171.14.13.117,"Vestibulum ac est lacinia nisi venenatis tristique. Fusce congue, diam id ornare imperdiet, sapien urna pretium nisl, ut volutpat sapien arcu sed augue. Aliquam erat volutpat.

In congue. Etiam justo. Etiam pretium iaculis justo.",9189.03,8/5/2022,6/26/2021,VestibulumAliquetUltrices.mov,5460 Lotheville Drive,false,paypal,false,tablet
Mallory,5,dskalls4@foxnews.com,dmee4,Dorie,dstollenberg4@printfriendly.com,dcucuzza4@sohu.com,465-809-4631,lectus in est risus auctor sed tristique in tempus sit,117.193.46.61,"Aenean lectus. Pellentesque eget nunc. Donec quis orci eget orci vehicula condimentum.

Curabitur in libero ut massa volutpat convallis. Morbi odio odio, elementum eu, interdum eu, tincidunt in, leo. Maecenas pulvinar lobortis est.",3224.84,7/5/2022,12/8/2022,AnteIpsum.pdf,40 Garrison Avenue,true,paypal,true,mobile
Kamillah,6,msolley5@zdnet.com,mraxworthy5,Marji,mlightman5@storify.com,mlangdon5@elegantthemes.com,263-163-5901,quis turpis eget elit sodales scelerisque mauris sit amet eros suspendisse accumsan tortor quis turpis sed ante vivamus tortor,135.118.108.1,"Sed sagittis. Nam congue, risus semper porta volutpat, quam pede lobortis ligula, sit amet eleifend pede libero quis orci. Nullam molestie nibh in lectus.

Pellentesque at nulla. Suspendisse potenti. Cras in purus eu magna vulputate luctus.

Cum sociis natoque penatibus et magnis dis parturient montes, nascetur ridiculus mus. Vivamus vestibulum sagittis sapien. Cum sociis natoque penatibus et magnis dis parturient montes, nascetur ridiculus mus.",6900.64,5/14/2022,2/2/2021,NislVenenatis.mp3,043 Mesta Court,true,paypal,true,tablet
Melinde,7,djoysey6@google.com.br,ddearlove6,Damian,dsimmins6@salon.com,djewkes6@unc.edu,580-218-3721,sapien dignissim vestibulum vestibulum ante ipsum primis in faucibus orci luctus et ultrices posuere,138.229.91.210,"Proin eu mi. Nulla ac enim. In tempor, turpis nec euismod scelerisque, quam turpis adipiscing lorem, vitae mattis nibh ligula nec sem.",3800.47,9/2/2022,10/7/2021,UllamcorperAugueA.tiff,62 Monterey Trail,false,bitcoin,false,desktop
Jimmie,8,astrase7@biblegateway.com,arossey7,Anatola,awonfor7@chronoengine.com,ahaldane7@is.gd,365-498-2082,ut massa volutpat convallis morbi odio odio elementum eu interdum eu tincidunt,157.55.124.222,"In hac habitasse platea dictumst. Etiam faucibus cursus urna. Ut tellus.

Nulla ut erat id mauris vulputate elementum. Nullam varius. Nulla facilisi.

Cras non velit nec nisi vulputate nonummy. Maecenas tincidunt lacus at velit. Vivamus vel nulla eget eros elementum pellentesque.",6453.4,5/12/2022,8/10/2020,VestibulumVelit.jpeg,25275 Dixon Way,false,credit card,false,tablet
Kip,9,zdanels8@seattletimes.com,zhyrons8,Zak,zlambis8@earthlink.net,zcharnick8@histats.com,857-964-5658,est risus auctor sed tristique in tempus sit amet sem,100.100.16.187,"Duis bibendum. Morbi non quam nec dui luctus rutrum. Nulla tellus.

In sagittis dui vel nisl. Duis ac nibh. Fusce lacus purus, aliquet at, feugiat non, pretium quis, lectus.",8652.42,4/16/2022,4/27/2022,RidiculusMus.ppt,4 Homewood Center,false,credit card,true,desktop
Luise,10,dhindrick9@twitter.com,dklimkovich9,Doria,dgopsell9@github.com,dcrennan9@cargocollective.com,777-395-2222,nulla justo aliquam quis turpis eget elit sodales scelerisque mauris sit amet eros,114.28.76.84,"Curabitur gravida nisi at nibh. In hac habitasse platea dictumst. Aliquam augue quam, sollicitudin vitae, consectetuer eget, rutrum at, lorem.

Integer tincidunt ante vel ipsum. Praesent blandit lacinia erat. Vestibulum sed magna at nunc commodo placerat.",6300.88,3/21/2022,12/9/2020,Morbi.mp3,684 Hollow Ridge Road,false,credit card,true,desktop
Ruddie,11,bkibblea@kickstarter.com,bbriknera,Brock,bherculsona@wikispaces.com,bdegregorioa@feedburner.com,672-651-9707,blandit lacinia erat vestibulum sed magna at nunc commodo placerat praesent blandit nam nulla integer pede justo,217.207.205.20,"Curabitur in libero ut massa volutpat convallis. Morbi odio odio, elementum eu, interdum eu, tincidunt in, leo. Maecenas pulvinar lobortis est.",2396.48,9/16/2022,5/19/2021,Nulla.mov,63 Rockefeller Avenue,true,bitcoin,false,tablet
Maurita,12,oleveretb@example.com,oivashkovb,Olivero,otremaineb@webmd.com,olightbownb@nymag.com,792-843-3896,nulla ultrices aliquet maecenas leo odio condimentum id luctus nec molestie sed justo pellentesque viverra pede ac diam cras,49.156.163.230,"Vestibulum quam sapien, varius ut, blandit non, interdum in, ante. Vestibulum ante ipsum primis in faucibus orci luctus et ultrices posuere cubilia Curae; Duis faucibus accumsan odio. Curabitur convallis.",829.7,12/7/2022,3/10/2021,GravidaNisiAt.mp3,9 Northridge Alley,false,credit card,false,mobile
Rowe,13,foldreyc@narod.ru,fstarkc,Frasco,fewerc@lycos.com,fblunec@amazon.co.uk,810-863-9069,libero rutrum ac lobortis vel dapibus at diam nam tristique tortor eu pede,91.223.134.172,"Etiam vel augue. Vestibulum rutrum rutrum neque. Aenean auctor gravida sem.

Praesent id massa id nisl venenatis lacinia. Aenean sit amet justo. Morbi ut odio.

Cras mi pede, malesuada in, imperdiet et, commodo vulputate, justo. In blandit ultrices enim. Lorem ipsum dolor sit amet, consectetuer adipiscing elit.",4.83,8/2/2022,7/15/2022,TurpisElementumLigula.doc,9 Leroy Court,false,credit card,false,mobile
Olly,14,aclarisd@360.cn,afegand,Annabal,avasserd@sina.com.cn,afarrisd@boston.com,785-385-5139,in hac habitasse platea dictumst aliquam augue quam sollicitudin vitae consectetuer eget rutrum at lorem,149.231.76.201,"In hac habitasse platea dictumst. Morbi vestibulum, velit id pretium iaculis, diam erat fermentum justo, nec condimentum neque sapien placerat ante. Nulla justo.

Aliquam quis turpis eget elit sodales scelerisque. Mauris sit amet eros. Suspendisse accumsan tortor quis turpis.",357.91,10/20/2022,11/17/2021,AliquamEratVolutpat.xls,304 Carey Junction,true,paypal,true,desktop
Hazlett,15,bleitchee@uiuc.edu,bscourgee,Belle,bvidineeve@alexa.com,bebenezere@people.com.cn,289-140-9101,eget congue eget semper rutrum nulla nunc purus phasellus in felis donec semper sapien a libero nam dui proin leo,85.14.193.197,"Cras mi pede, malesuada in, imperdiet et, commodo vulputate, justo. In blandit ultrices enim. Lorem ipsum dolor sit amet, consectetuer adipiscing elit.

Proin interdum mauris non ligula pellentesque ultrices. Phasellus id sapien in sapien iaculis congue. Vivamus metus arcu, adipiscing molestie, hendrerit at, vulputate vitae, nisl.",6529.78,8/31/2022,9/5/2022,ConsectetuerAdipiscingElit.jpeg,68405 Pleasure Terrace,false,credit card,true,mobile
Leontine,16,bbeehof@kickstarter.com,bfairlawf,Bogey,bmolloyf@flickr.com,bballsdonf@flickr.com,606-845-0727,quam pharetra magna ac consequat metus sapien ut nunc vestibulum ante ipsum primis,23.183.108.189,In quis justo. Maecenas rhoncus aliquam lacus. Morbi quis tortor id nulla ultrices aliquet.,3222.58,2/25/2022,4/30/2022,Tempus.png,73670 Canary Park,false,credit card,true,mobile
Darbee,17,gteresag@wikipedia.org,gurlichg,Gretta,gburkhillg@dedecms.com,grainsg@youtu.be,997-958-1937,sed accumsan felis ut at dolor quis odio consequat varius integer ac leo pellentesque,7.217.22.122,"Mauris enim leo, rhoncus sed, vestibulum sit amet, cursus id, turpis. Integer aliquet, massa id lobortis convallis, tortor risus dapibus augue, vel accumsan tellus nisi eu orci. Mauris lacinia sapien quis libero.

Nullam sit amet turpis elementum ligula vehicula consequat. Morbi a ipsum. Integer a nibh.",454.98,8/15/2022,10/9/2022,TurpisEget.txt,618 Northridge Lane,false,bitcoin,false,desktop
Ced,18,kprierh@vkontakte.ru,kmcalindenh,Kitti,krayerh@livejournal.com,kwaltonh@wix.com,450-525-4266,adipiscing elit proin risus praesent lectus vestibulum quam sapien varius ut blandit non interdum in ante vestibulum ante ipsum primis,9.236.199.179,"Praesent id massa id nisl venenatis lacinia. Aenean sit amet justo. Morbi ut odio.

Cras mi pede, malesuada in, imperdiet et, commodo vulputate, justo. In blandit ultrices enim. Lorem ipsum dolor sit amet, consectetuer adipiscing elit.",7594.2,2/6/2022,6/14/2022,RutrumAcLobortis.pdf,3 Sachs Lane,false,credit card,true,mobile
Adelheid,19,aduggoni@biblegateway.com,achristleyi,Aldridge,akenani@hud.gov,aidiensi@harvard.edu,589-292-0719,molestie lorem quisque ut erat curabitur gravida nisi at nibh in hac habitasse platea dictumst,169.228.3.19,Integer tincidunt ante vel ipsum. Praesent blandit lacinia erat. Vestibulum sed magna at nunc commodo placerat.,988.96,5/23/2022,4/12/2022,SitAmetEros.mpeg,641 Gale Court,false,paypal,true,mobile
Margaux,20,jkarpmanj@tripadvisor.com,jguilderj,Jammal,jjodlkowskij@ca.gov,jastallj@umn.edu,410-938-2751,non lectus aliquam sit amet diam in magna bibendum imperdiet nullam orci pede,131.226.20.76,"Duis bibendum. Morbi non quam nec dui luctus rutrum. Nulla tellus.

In sagittis dui vel nisl. Duis ac nibh. Fusce lacus purus, aliquet at, feugiat non, pretium quis, lectus.",848.48,8/16/2022,7/22/2022,Convallis.tiff,95 Londonderry Center,true,credit card,false,tablet
Frazer,21,oleathleyk@cornell.edu,ovyvyank,Obed,oportamk@mozilla.org,obamptonk@de.vu,900-258-4321,sed interdum venenatis turpis enim blandit mi in porttitor pede justo eu massa donec dapibus duis at,64.142.86.213,Maecenas ut massa quis augue luctus tincidunt. Nulla mollis molestie lorem. Quisque ut erat.,4298.12,8/1/2022,3/18/2021,EleifendPede.ppt,455 Valley Edge Place,false,bitcoin,false,desktop
Chelsie,22,cblackslandl@instagram.com,cbrandinl,Clerissa,chegell@economist.com,caldiel@oracle.com,841-998-6601,quam pharetra magna ac consequat metus sapien ut nunc vestibulum ante ipsum primis in faucibus orci luctus et ultrices posuere,5.171.97.15,"Duis aliquam convallis nunc. Proin at turpis a pede posuere nonummy. Integer non velit.

Donec diam neque, vestibulum eget, vulputate ut, ultrices vel, augue. Vestibulum ante ipsum primis in faucibus orci luctus et ultrices posuere cubilia Curae; Donec pharetra, magna vestibulum aliquet ultrices, erat tortor sollicitudin mi, sit amet lobortis sapien sapien non mi. Integer ac neque.

Duis bibendum. Morbi non quam nec dui luctus rutrum. Nulla tellus.",9553.21,11/18/2022,3/24/2020,AtVulputate.png,09358 Ronald Regan Court,true,credit card,false,desktop
Kylie,23,sbickleym@abc.net.au,slindenm,Sheilah,smorsem@imgur.com,swolfingerm@newsvine.com,725-679-9479,nullam sit amet turpis elementum ligula vehicula consequat morbi a,250.92.240.110,Nullam porttitor lacus at turpis. Donec posuere metus vitae ipsum. Aliquam non mauris.,5277.11,3/7/2022,12/30/2021,EleifendLuctusUltricies.ppt,70 Armistice Pass,true,paypal,false,mobile
Allyn,24,bridenn@constantcontact.com,bleffekn,Beverly,bkendrickn@github.io,bstarien@virginia.edu,437-510-1129,ipsum dolor sit amet consectetuer adipiscing elit proin interdum mauris non ligula pellentesque ultrices phasellus id sapien in sapien iaculis,108.243.237.43,"Nulla ut erat id mauris vulputate elementum. Nullam varius. Nulla facilisi.

Cras non velit nec nisi vulputate nonummy. Maecenas tincidunt lacus at velit. Vivamus vel nulla eget eros elementum pellentesque.

Quisque porta volutpat erat. Quisque erat eros, viverra eget, congue eget, semper rutrum, nulla. Nunc purus.",1537.89,8/27/2022,2/8/2022,UtMauris.tiff,4813 Westend Junction,true,paypal,true,tablet
Saxon,25,bstapelso@hibu.com,bitzkovwitcho,Burgess,bgillingwatero@disqus.com,bfairallo@lulu.com,928-419-3718,proin leo odio porttitor id consequat in consequat ut nulla sed accumsan felis,87.130.55.31,"Nullam porttitor lacus at turpis. Donec posuere metus vitae ipsum. Aliquam non mauris.

Morbi non lectus. Aliquam sit amet diam in magna bibendum imperdiet. Nullam orci pede, venenatis non, sodales sed, tincidunt eu, felis.

Fusce posuere felis sed lacus. Morbi sem mauris, laoreet ut, rhoncus aliquet, pulvinar sed, nisl. Nunc rhoncus dui vel sem.",7370.54,12/7/2022,12/5/2022,NonQuamNec.txt,2533 Lighthouse Bay Trail,false,credit card,true,mobile
Trixy,26,sscurlockp@shareasale.com,soshieldsp,Starlene,svorleyp@homestead.com,sduchasteaup@desdev.cn,384-822-4127,aliquam sit amet diam in magna bibendum imperdiet nullam orci pede venenatis non sodales sed tincidunt,111.159.252.7,"Nullam porttitor lacus at turpis. Donec posuere metus vitae ipsum. Aliquam non mauris.

Morbi non lectus. Aliquam sit amet diam in magna bibendum imperdiet. Nullam orci pede, venenatis non, sodales sed, tincidunt eu, felis.",9504.11,2/21/2022,1/19/2022,Semper.doc,7570 Manley Hill,true,paypal,false,tablet
Osbert,27,dsurmeirq@nature.com,dgiuroniq,Derril,dlambertiq@miitbeian.gov.cn,dstormonthq@google.es,855-173-9216,tellus in sagittis dui vel nisl duis ac nibh fusce lacus purus aliquet at feugiat non pretium quis lectus suspendisse,60.43.157.246,"In hac habitasse platea dictumst. Etiam faucibus cursus urna. Ut tellus.

Nulla ut erat id mauris vulputate elementum. Nullam varius. Nulla facilisi.",2163.51,12/23/2022,9/5/2022,Vestibulum.gif,9 Lotheville Trail,true,paypal,false,mobile
Joyce,28,cskillenr@bizjournals.com,creschker,Charlie,cnorthcliffer@xing.com,cmaudlingr@cam.ac.uk,648-894-4371,nulla mollis molestie lorem quisque ut erat curabitur gravida nisi at nibh in,117.223.23.36,"Vestibulum ac est lacinia nisi venenatis tristique. Fusce congue, diam id ornare imperdiet, sapien urna pretium nisl, ut volutpat sapien arcu sed augue. Aliquam erat volutpat.

In congue. Etiam justo. Etiam pretium iaculis justo.

In hac habitasse platea dictumst. Etiam faucibus cursus urna. Ut tellus.",526.46,7/17/2022,6/5/2020,EleifendQuam.avi,630 North Court,false,credit card,true,tablet
Dari,29,bbaises@miitbeian.gov.cn,bhancorns,Bondie,bhendricks@tiny.cc,burens@nasa.gov,533-795-3126,odio consequat varius integer ac leo pellentesque ultrices mattis odio donec vitae nisi nam,7.112.84.142,"Maecenas tristique, est et tempus semper, est quam pharetra magna, ac consequat metus sapien ut nunc. Vestibulum ante ipsum primis in faucibus orci luctus et ultrices posuere cubilia Curae; Mauris viverra diam vitae quam. Suspendisse potenti.

Nullam porttitor lacus at turpis. Donec posuere metus vitae ipsum. Aliquam non mauris.",4458.44,12/25/2022,10/10/2022,OrnareConsequat.xls,84 Kensington Point,false,paypal,true,desktop
Jenica,30,gspottiswoodet@quantcast.com,gvanderweedenburgt,Gretel,gpearminet@unc.edu,gudiet@hao123.com,665-830-7040,augue luctus tincidunt nulla mollis molestie lorem quisque ut erat,138.102.35.98,"Curabitur in libero ut massa volutpat convallis. Morbi odio odio, elementum eu, interdum eu, tincidunt in, leo. Maecenas pulvinar lobortis est.

Phasellus sit amet erat. Nulla tempus. Vivamus in felis eu sapien cursus vestibulum.",7701.66,2/4/2022,1/9/2021,DiamEratFermentum.avi,454 Continental Crossing,true,bitcoin,true,mobile
Sheree,31,mbiasioliu@irs.gov,mseabrookeu,Mackenzie,mtallonu@theguardian.com,mattenboroughu@telegraph.co.uk,226-873-4619,praesent blandit nam nulla integer pede justo lacinia eget tincidunt eget tempus vel pede morbi porttitor lorem id ligula,15.247.22.19,"Sed ante. Vivamus tortor. Duis mattis egestas metus.

Aenean fermentum. Donec ut mauris eget massa tempor convallis. Nulla neque libero, convallis eget, eleifend luctus, ultricies eu, nibh.

Quisque id justo sit amet sapien dignissim vestibulum. Vestibulum ante ipsum primis in faucibus orci luctus et ultrices posuere cubilia Curae; Nulla dapibus dolor vel est. Donec odio justo, sollicitudin ut, suscipit a, feugiat et, eros.",9479.41,10/9/2022,8/21/2022,NonVelitNec.xls,860 Claremont Road,true,credit card,true,desktop
Jone,32,lallchornev@naver.com,loldacresv,Lotte,lparnallv@samsung.com,lpelchatv@oaic.gov.au,803-793-2085,integer ac neque duis bibendum morbi non quam nec dui luctus rutrum nulla tellus in,125.102.118.89,"Vestibulum quam sapien, varius ut, blandit non, interdum in, ante. Vestibulum ante ipsum primis in faucibus orci luctus et ultrices posuere cubilia Curae; Duis faucibus accumsan odio. Curabitur convallis.",1487.82,9/19/2022,3/27/2021,VariusInteger.avi,35 Monument Point,false,paypal,true,mobile
Randi,33,vpettkow@tripadvisor.com,vpitrassow,Vinny,vtomblinw@elpais.com,vriteleyw@paginegialle.it,746-453-4199,vulputate nonummy maecenas tincidunt lacus at velit vivamus vel nulla eget eros,6.40.249.168,"Donec diam neque, vestibulum eget, vulputate ut, ultrices vel, augue. Vestibulum ante ipsum primis in faucibus orci luctus et ultrices posuere cubilia Curae; Donec pharetra, magna vestibulum aliquet ultrices, erat tortor sollicitudin mi, sit amet lobortis sapien sapien non mi. Integer ac neque.",7643.51,5/25/2022,6/12/2022,DapibusDuisAt.avi,0635 Mandrake Plaza,false,credit card,true,desktop
Almeria,34,agrigoriox@macromedia.com,aguerrierx,Andrus,adodshunx@wikispaces.com,awoolhamx@hhs.gov,697-866-7442,amet erat nulla tempus vivamus in felis eu sapien cursus vestibulum proin eu mi nulla ac enim in tempor turpis,58.45.168.12,Suspendisse potenti. In eleifend quam a odio. In hac habitasse platea dictumst.,8880.27,10/7/2022,9/20/2021,SitAmetSem.gif,79 Darwin Road,false,paypal,false,tablet
Adi,35,pbealy@dmoz.org,ptrimmelly,Paolina,probertzy@pbs.org,pchastely@netvibes.com,872-171-9720,vel nisl duis ac nibh fusce lacus purus aliquet at feugiat non pretium quis,212.98.9.118,"Aenean lectus. Pellentesque eget nunc. Donec quis orci eget orci vehicula condimentum.

Curabitur in libero ut massa volutpat convallis. Morbi odio odio, elementum eu, interdum eu, tincidunt in, leo. Maecenas pulvinar lobortis est.

Phasellus sit amet erat. Nulla tempus. Vivamus in felis eu sapien cursus vestibulum.",9945.96,4/18/2022,12/9/2020,IdMassaId.doc,406 High Crossing Crossing,false,paypal,false,mobile
Deloris,36,bmatherz@canalblog.com,bbernadez,Bronson,bdumbrillz@trellian.com,barringtonz@technorati.com,220-518-5636,non velit donec diam neque vestibulum eget vulputate ut ultrices vel augue vestibulum ante ipsum primis in faucibus,62.49.216.66,"Sed sagittis. Nam congue, risus semper porta volutpat, quam pede lobortis ligula, sit amet eleifend pede libero quis orci. Nullam molestie nibh in lectus.

Pellentesque at nulla. Suspendisse potenti. Cras in purus eu magna vulputate luctus.",8203.61,5/29/2022,1/8/2022,VelSemSed.gif,93394 Fallview Pass,true,bitcoin,false,desktop
Moina,37,dgriston10@blog.com,dhentze10,Derek,dspurrett10@goo.ne.jp,dtchir10@reference.com,412-533-9897,sed interdum venenatis turpis enim blandit mi in porttitor pede justo eu massa donec dapibus,24.184.144.130,"In hac habitasse platea dictumst. Morbi vestibulum, velit id pretium iaculis, diam erat fermentum justo, nec condimentum neque sapien placerat ante. Nulla justo.

Aliquam quis turpis eget elit sodales scelerisque. Mauris sit amet eros. Suspendisse accumsan tortor quis turpis.

Sed ante. Vivamus tortor. Duis mattis egestas metus.",9800.64,9/6/2022,7/22/2022,NullamOrciPede.mp3,3 Novick Way,true,bitcoin,true,desktop
Kacey,38,mfieldhouse11@telegraph.co.uk,mondrusek11,Michelle,milliston11@yelp.com,mgergely11@sciencedaily.com,481-104-1393,vestibulum vestibulum ante ipsum primis in faucibus orci luctus et ultrices posuere cubilia curae nulla,235.247.163.119,Cras non velit nec nisi vulputate nonummy. Maecenas tincidunt lacus at velit. Vivamus vel nulla eget eros elementum pellentesque.,4246.64,8/6/2022,9/6/2022,Consectetuer.tiff,1 Mccormick Point,false,credit card,false,tablet
Meredithe,39,kdecruze12@privacy.gov.au,kapplewhite12,Konstance,krathe12@discovery.com,kbruhnke12@lycos.com,525-670-0264,leo pellentesque ultrices mattis odio donec vitae nisi nam ultrices libero non,83.249.245.87,"Aenean fermentum. Donec ut mauris eget massa tempor convallis. Nulla neque libero, convallis eget, eleifend luctus, ultricies eu, nibh.",5571.06,5/22/2022,5/14/2022,DonecDapibusDuis.mov,73904 Ryan Trail,false,bitcoin,false,mobile
Shannen,40,sschukert13@boston.com,scodner13,Saleem,sbruggen13@histats.com,smcmeyler13@harvard.edu,676-287-6882,nulla eget eros elementum pellentesque quisque porta volutpat erat quisque erat,4.108.215.95,"Duis bibendum. Morbi non quam nec dui luctus rutrum. Nulla tellus.

In sagittis dui vel nisl. Duis ac nibh. Fusce lacus purus, aliquet at, feugiat non, pretium quis, lectus.",4161.95,9/4/2022,3/1/2022,PraesentIdMassa.xls,67943 Golf Point,false,bitcoin,false,mobile
Sharai,41,lstow14@hostgator.com,lfake14,Lanie,lcritoph14@youtu.be,loverington14@shop-pro.jp,573-494-8723,mauris enim leo rhoncus sed vestibulum sit amet cursus id turpis integer aliquet massa id lobortis convallis,84.91.110.2,"Duis bibendum, felis sed interdum venenatis, turpis enim blandit mi, in porttitor pede justo eu massa. Donec dapibus. Duis at velit eu est congue elementum.",6053.26,12/22/2022,3/15/2022,Luctus.ppt,7284 Boyd Crossing,false,credit card,false,desktop
Conchita,42,kfurmagier15@jiathis.com,kkasman15,Kevan,kmears15@wisc.edu,kdeftie15@vinaora.com,667-133-4013,pellentesque volutpat dui maecenas tristique est et tempus semper est quam pharetra magna ac consequat metus sapien,94.140.35.36,"Nullam sit amet turpis elementum ligula vehicula consequat. Morbi a ipsum. Integer a nibh.

In quis justo. Maecenas rhoncus aliquam lacus. Morbi quis tortor id nulla ultrices aliquet.",3506.5,12/28/2022,10/3/2022,EtMagnis.mov,40143 Dwight Crossing,true,credit card,false,tablet
Veronica,43,cmcdade16@reddit.com,clambregts16,Christalle,cplues16@tripadvisor.com,chuygens16@wikispaces.com,710-734-2076,consequat metus sapien ut nunc vestibulum ante ipsum primis in faucibus orci luctus et,1.94.228.10,"Curabitur at ipsum ac tellus semper interdum. Mauris ullamcorper purus sit amet nulla. Quisque arcu libero, rutrum ac, lobortis vel, dapibus at, diam.",8441.43,12/29/2022,1/26/2021,TurpisAdipiscingLorem.gif,343 Hansons Point,false,paypal,true,tablet
Brantley,44,dmessham17@house.gov,dpennycook17,Dotti,dodd17@surveymonkey.com,dgladding17@github.io,794-202-9383,sapien non mi integer ac neque duis bibendum morbi non quam nec dui luctus,151.185.204.38,"Duis aliquam convallis nunc. Proin at turpis a pede posuere nonummy. Integer non velit.

Donec diam neque, vestibulum eget, vulputate ut, ultrices vel, augue. Vestibulum ante ipsum primis in faucibus orci luctus et ultrices posuere cubilia Curae; Donec pharetra, magna vestibulum aliquet ultrices, erat tortor sollicitudin mi, sit amet lobortis sapien sapien non mi. Integer ac neque.

Duis bibendum. Morbi non quam nec dui luctus rutrum. Nulla tellus.",3702.09,5/15/2022,7/3/2020,LuctusTinciduntNulla.ppt,456 Di Loreto Road,false,credit card,false,desktop
Wynnie,45,gstanbury18@discovery.com,ggionettitti18,Grover,gmassie18@adobe.com,gcarsey18@posterous.com,452-134-9334,urna ut tellus nulla ut erat id mauris vulputate elementum nullam varius nulla facilisi,52.72.208.132,"Nam ultrices, libero non mattis pulvinar, nulla pede ullamcorper augue, a suscipit nulla elit ac nulla. Sed vel enim sit amet nunc viverra dapibus. Nulla suscipit ligula in lacus.",7541.07,6/23/2022,9/2/2020,LuctusEtUltrices.doc,072 Buell Court,true,credit card,false,tablet
Burton,46,hskillanders19@barnesandnoble.com,hsaunper19,Halette,hilive19@shinystat.com,hbibb19@cornell.edu,355-468-4585,ac tellus semper interdum mauris ullamcorper purus sit amet nulla quisque arcu libero rutrum ac lobortis vel,254.124.200.204,"Sed sagittis. Nam congue, risus semper porta volutpat, quam pede lobortis ligula, sit amet eleifend pede libero quis orci. Nullam molestie nibh in lectus.",8439.33,9/15/2022,11/21/2021,MontesNascetur.avi,04 Shopko Avenue,true,credit card,true,mobile
